web-scraper-order,web-scraper-start-url,Name,Units Sold,Price
1759480746-364,https://shopee.com.my/glamstory#product_list,JUMISO Pore Purifying Salicylic Acid Foaming Cleanser 120g,36 sold,39.90
1759480746-365,https://shopee.com.my/glamstory#product_list,BENTON Ceramide Cream 10000ppm 80ml [GLAM],89 sold,45.00
1759480746-366,https://shopee.com.my/glamstory#product_list,DR. MELAXIN Brightening Mask 25g / Repair Mask Pack 30g / Renewal Mask Pack 30g [1 Sheet],12 sold,7.97
1759480746-367,https://shopee.com.my/glamstory#product_list,PYUNKANG YUL Acne Dressing Mask Pack / Acne Spot Patch Super Thin  [GLAM],7k+ sold,3.90
1759480746-368,https://shopee.com.my/glamstory#product_list,MARY & MAY Vitamin B.C.E Cleansing Balm 120g [GLAM],47 sold,55.00
1759480746-369,https://shopee.com.my/glamstory#product_list,Rareblee Glow Drop Body Filter Deodorant Pink Bloom / Green Bliss 50ml,3 sold,39.90
1759480746-370,https://shopee.com.my/glamstory#product_list,PURITO Seoul Wonder Releaf Centella Toner 200ml,2 sold,64.30
1759480746-371,https://shopee.com.my/glamstory#product_list,COSRX Advanced Snail Radiance Dual Essence 80ml [GLAM],349 sold,69.30
1759480746-372,https://shopee.com.my/glamstory#product_list,SOME BY MI V10 Hyal Anti-Oxidant / Hydra Capsule / Air Fit Sunscreen 5ml / 40ml / 50ml [GLAM],7k+ sold,9.90
1759480746-373,https://shopee.com.my/glamstory#product_list,MARY & MAY Houttuynia Cordata + Tea Tree / White Collagen Cleansing Foam 150ml [GLAM],272 sold,29.00
1759480746-374,https://shopee.com.my/glamstory#product_list,ANUA Heartleaf Silky Moisture Sunscreen 50ml [GLAM],4k+ sold,52.06
1759480746-375,https://shopee.com.my/glamstory#product_list,B-LAB Cica Barrier 5.5 Gel Cleanser / Cleansing Oil Balm 100ml / 120ml [GLAM],4k+ sold,24.90
1759480746-376,https://shopee.com.my/glamstory#product_list,ETUDE HOUSE Baking Powder Crunch Pore Scrub 7g x 24pc / 200g [GLAM],335 sold,23.90
1759480746-377,https://shopee.com.my/glamstory#product_list,HOUSE OF HUR Weightless Sun Fluid SPF50+ PA++++ 50ml [GLAM],70 sold,53.00
1759480746-378,https://shopee.com.my/glamstory#product_list,BEAUTY OF JOSEON Ginseng Moist Sun Serum SPF50+ PA++++ 50ml [GLAM],58 sold,36.00
1759480746-379,https://shopee.com.my/glamstory#product_list,NAAP Reti Core 2.0 / Reju Core 4.0 Cream 50ml,,60.15
1759480746-380,https://shopee.com.my/glamstory#product_list,LANEIGE RADIAN-C SUN CREAM SPF 50+ PA++++ 50ml,4k+ sold,75.00
1759480746-381,https://shopee.com.my/glamstory#product_list,ISNTREE Hyaluronic Acid Toner 200ml / 400ml [GLAM],333 sold,39.00
1759480746-382,https://shopee.com.my/glamstory#product_list,NATURE REPUBLIC California Aloe Daily Sun Block SPF50+ 50 PA++++,7 sold,38.00
1759480746-383,https://shopee.com.my/glamstory#product_list,SEAPURI Scalpy Anti Hair Loss Serum Ampoule 20ml,869 sold,99.00
1759480746-384,https://shopee.com.my/glamstory#product_list,APIEU Goblin Blackhead 3 Step Nose Pack [GLAM],2k+ sold,4.99
1759480746-385,https://shopee.com.my/glamstory#product_list,BEAUTY OF JOSEON Light On Serum Centella + Vita C 10ml / 30ml [GLAM],78 sold,39.90
1759480746-386,https://shopee.com.my/glamstory#product_list,NUMBUZIN N0.2 Deep Clean Fresh Cream Cleanser 120ml [GLAM],61 sold,33.00
1759480746-387,https://shopee.com.my/glamstory#product_list,FOREVER LIVING LIQUID HAND SOAP [GLAM],376 sold,90.50
1759480746-388,https://shopee.com.my/glamstory#product_list,HEIMISH Bulgarian Rose Tone-up Sunscreen SPF50+ PA+++ 30ml [GLAM],49 sold,59.90
1759480746-389,https://shopee.com.my/glamstory#product_list,COSRX Hyaluronic Acid Hydra Power Essence 100ml [GLAM],1k+ sold,44.90
1759480746-390,https://shopee.com.my/glamstory#product_list,KAINE Vita Drop / Chaga Collagen / Rosemary 30ml,6 sold,40.00
1759480746-391,https://shopee.com.my/glamstory#product_list,ANUA Heartleaf 70% Daily Lotion 200ml / Intense Calming Cream 50ml [GLAM],31 sold,59.90
1759480746-392,https://shopee.com.my/glamstory#product_list,Forever Living Aloe Scrub [GLAM],150 sold,58.30
1759480746-393,https://shopee.com.my/glamstory#product_list,HARUHARU Wonder Black Rice Hyaluronic Toner 300ml [GLAM],86 sold,66.00
1759480746-394,https://shopee.com.my/glamstory#product_list,Medicube Mask Sheet Collection 27g (1 Sheet),2 sold,9.60
1759480746-395,https://shopee.com.my/glamstory#product_list,NARD Sensitive Scalp Care Shampoo / Treatment 500ml [GLAM],103 sold,39.90
1759480746-396,https://shopee.com.my/glamstory#product_list,COSRX Two In One Poreless Power Liquid 100ml [GLAM],9k+ sold,45.90
1759480746-397,https://shopee.com.my/glamstory#product_list,TOCOBO Vita Glazed Lip Mask 20ml [GLAM],161 sold,45.00
1759480746-398,https://shopee.com.my/glamstory#product_list,COSRX AC Collection Calming Liquid Intensive / Mild (30ml /125ml) [GLAM],588 sold,45.00
1759480746-399,https://shopee.com.my/glamstory#product_list,BARULAB The Clean Vegan Mask 23g [GLAM],2k+ sold,2.88
1759480746-400,https://shopee.com.my/glamstory#product_list,NUMBUZIN No.1 Clear Filter Sun Essence SPF 50+ PA++++ 50ml,73 sold,56.00
1759480746-401,https://shopee.com.my/glamstory#product_list,COSRX Advance Snail Peptide Eye Cream 25ml [GLAM],140 sold,56.90
1759480746-402,https://shopee.com.my/glamstory#product_list,HARUHARU Wonder Black Rice Bakuchiol Eye Cream 20ml,27 sold,45.00
1759480746-403,https://shopee.com.my/glamstory#product_list,PYUNKANG YUL Moisture Ampoule 100ml [GLAM],159 sold,66.00
1759480746-404,https://shopee.com.my/glamstory#product_list,ABIB Gummy Sheet Mask Heartleaf / Hyaluron / Madecassoside / Collagen Milk Sticker 27ml [GLAM],6k+ sold,5.99
1759480746-405,https://shopee.com.my/glamstory#product_list,DR.CEURACLE Hyal Reyouth Hydrogel Eye Mask (1.5*60EA) [GLAM],839 sold,59.00
1759480746-406,https://shopee.com.my/glamstory#product_list,BENTON Aloe Soothing Mask Pack (1 Sheet) [GLAM],1k+ sold,5.00
1759480746-407,https://shopee.com.my/glamstory#product_list,EAMAS PROFESSIONNEL Treatment Balm 120ml/Scalp Serum 100ml/Scalp Peeling 15ml/Scalp Masque 20ml/Lenitive Booster 12ml,2k+ sold,75.00
1759480746-408,https://shopee.com.my/glamstory#product_list,KLAIRS Rich Moist Soothing Cream 20g / 80g / Foaming Cleanser 100ml / Serum 80ml,64 sold,59.00
1759480746-409,https://shopee.com.my/glamstory#product_list,IZEZE Black Cumin NTP Bliss Cleansing Oil 200ml / Essence 100ml / Serum 30ml / Suncream 50ml,1 sold,44.60
1759480746-410,https://shopee.com.my/glamstory#product_list,AHC Premium Hydra Soother Cellulose / Skin Fit Mask Soothing Enhancer MASK,691 sold,29.60
1759480746-411,https://shopee.com.my/glamstory#product_list,Forever Living Aloe Massage Lotion [GLAM],286 sold,53.00
1759480746-412,https://shopee.com.my/glamstory#product_list,MEDIHEAL Watermide / Collagen / Madecassoside / Vitamide / TeaTree / Phyto-Enzyme / Retinol Pad,480 sold,80.10
1759480746-413,https://shopee.com.my/glamstory#product_list,VT COSMETICS Reedle Shot EX Modeling Pack 25g,19 sold,8.99
1759480746-414,https://shopee.com.my/glamstory#product_list,BEPLAIN Sunmuse Tone Up & Correcting Sunscreen SPF50+ PA++++ 50ml,147 sold,46.90
1759480746-415,https://shopee.com.my/glamstory#product_list,ANUA Heartleaf 77% Soothing / Cream Night / Birch Moisture / Peach Niacin / Green Lemon / Green Tangerine Mask [GLAM],310 sold,5.95
1759480746-416,https://shopee.com.my/glamstory#product_list,TOCOBO Glow Ritual / Glass Tinted / Powder Cream / Vitamin Nourishing Lip Balm 3.5g [GLAM],140 sold,23.00
1759480746-417,https://shopee.com.my/glamstory#product_list,AXIS-Y Biome Toner Essence Recharging Night Set Moringa Cleansing Oil Ultimate Cream Skin Lux Edition [GLAM],2k+ sold,39.00
1759480746-418,https://shopee.com.my/glamstory#product_list,PYUNKANG YUL Highly Moisturizing Essence / Calming / Black Tea Revitalizing Mask Pack (1 Sheet) [GLAM],713 sold,4.50
1759480746-419,https://shopee.com.my/glamstory#product_list,NAAP Skin Moisture Hydrating Ampoule 10 Types 30ml,18 sold,30.00
1759480746-420,https://shopee.com.my/glamstory#product_list,TOCOBO Collagen Brightening Eye Gel Cream 30ml [GLAM],44 sold,33.00
1759480746-421,https://shopee.com.my/glamstory#product_list,COSRX Hydrium Triple Hyaluronic Moisture Cleanser 150ml [GLAM],113 sold,33.90
1759480746-422,https://shopee.com.my/glamstory#product_list,ISNTREE Hyaluronic Acid Low pH Cleansing Foam 2ml / 150ml [GLAM],655 sold,39.50
1759480746-423,https://shopee.com.my/glamstory#product_list,ANUA Heartleaf 80% Soothing Ampoule 30ml [GLAM],25 sold,59.90
1759480746-424,https://shopee.com.my/glamstory#product_list,Ruruberry Pump (1 pcs),1 sold,9.90
1759480746-425,https://shopee.com.my/glamstory#product_list,GOODAL Green Tangerine Vita C Dark Spot tone up cream SPF 50+ PA++++ 50ml,23 sold,46.00
1759480746-426,https://shopee.com.my/glamstory#product_list,HYAAH Licorice First Essence 200ml,1 sold,59.00
1759480746-427,https://shopee.com.my/glamstory#product_list,EAMAS PROFESSIONNEL Energizing Shampoo / Lenitive Shampoo / Balancing Scalp Shampoo 300ml,1k+ sold,79.00
1759480746-428,https://shopee.com.my/glamstory#product_list,BEAUTY OF JOSEON Centella Asiatica Calming Mask 25ml (1 Sheet) [GLAM],2k+ sold,6.38
1759480746-429,https://shopee.com.my/glamstory#product_list,SECRET KEY Lemon Sparkling Cleansing Foam 200g / Peeling Gel 120ml [GLAM],336 sold,39.00
1759480746-430,https://shopee.com.my/glamstory#product_list,PYUNKANG YUL Black Tea Time Reverse Eye Cream 9ml / 25ml [GLAM],209 sold,76.00
1759480746-431,https://shopee.com.my/glamstory#product_list,ISNTREE Hyaluronic Acid Water Essence 50ml [GLAM],203 sold,49.00
1759480746-432,https://shopee.com.my/glamstory#product_list,COSRX Hydrium Green Tea Aqua Soothing Gel Cream / Moisture Power Enriched Cream 50ml [GLAM],10k+ sold,49.90
1759480746-433,https://shopee.com.my/glamstory#product_list,MARY & MAY Cica Soothing Sun Cream / Vegan Peptide Bakuchiol Sun Stick SPF50+ PA++++ 50ml [GLAM],337 sold,45.00
1759480746-434,https://shopee.com.my/glamstory#product_list,IZEZE Hyper CSA Cica Cleanser 150ml / Toner 150ml / Serum 30ml / Cream 50ml,,44.60
1759480746-435,https://shopee.com.my/glamstory#product_list,HARUHARU Wonder Centella 3% PHA Exfoliating Serum 120ml,7 sold,59.30
1759480746-436,https://shopee.com.my/glamstory#product_list,TOCOBO Multi Creamide Cream 50ml / 1ml [GLAM],56 sold,45.00
1759480746-437,https://shopee.com.my/glamstory#product_list,IZEZE Soul HNA Hydro Cleanser 150ml / Toner 150ml / Serum 30ml / Cream 50ml,1 sold,44.60
1759480746-438,https://shopee.com.my/glamstory#product_list,HYAAH All-in-One Ectoin Lotion 100ml,1 sold,59.00
1759480746-439,https://shopee.com.my/glamstory#product_list,IZEZE Porpolis PBA Enrich Serum Pure And Veritable 30ml,,44.60
1759480746-440,https://shopee.com.my/glamstory#product_list,NATURE REPUBLIC Argan Essential Deep Care Conditioner / Shampoo / Essence / Hair Pack [GLAM],1k+ sold,39.90
1759480746-441,https://shopee.com.my/glamstory#product_list,HEIMISH Bulgarian Rose Satin Cream 55ml [GLAM],61 sold,53.00
1759480746-442,https://shopee.com.my/glamstory#product_list,JUMISO Super Soothing Cica & Aloe Essence  / All Day Vitamin Glow Boost Facial Toner 125ml [GLAM],95 sold,26.00
1759480746-443,https://shopee.com.my/glamstory#product_list,ISNTREE Chestnut AHA 8% Clear Essence 100ml,374 sold,4.40
1759480746-444,https://shopee.com.my/glamstory#product_list,HEIMISH All Clean White Clay Foam 150ml [GLAM],2k+ sold,32.40
1759480746-445,https://shopee.com.my/glamstory#product_list,COSRX AC Collection Lightweight Soothing Moisturizer 80ml / Calming Liquid Intensive 125ml / Ultimate Spot Cream 30g,498 sold,45.00
1759480746-446,https://shopee.com.my/glamstory#product_list,COSRX AC Collection Ultimate Spot Cream 5g / 30g [GLAM],287 sold,48.45
1759480746-447,https://shopee.com.my/glamstory#product_list,THE RAW. Awaken Young Eye Serum 15ml,3 sold,59.90
1759480746-448,https://shopee.com.my/glamstory#product_list,PYUNKANG YUL Black Tea Revitalizing Mask Pack (1 Sheet) [GLAM],336 sold,6.50
1759480746-449,https://shopee.com.my/glamstory#product_list,HEIMISH Matcha Biome Hydrogel Eye Patch / Amino Acne Cleansing Foam / Intensive Repair Cream,72 sold,39.90
1759480746-450,https://shopee.com.my/glamstory#product_list,DR. JART + Every Sun Day Moisturizing / Mild / Tone Up  / Waterproof Sunscreen Sunmilk / Suntick SPF 50+ PA++++ 30ml,43 sold,49.90