web-scraper-order,web-scraper-start-url,Name,Units Sold,Price
1759480746-178,https://shopee.com.my/glamstory#product_list,MEDICUBE PDRN Pink Collagen Gel Mask 28g,1k+ sold,16.00
1759480746-179,https://shopee.com.my/glamstory#product_list,AXIS-Y Mugwort Pore Clarifying Wash Off Pack / New Skin Resolution Gel Mask 100ml,6k+ sold,20.00
1759480746-180,https://shopee.com.my/glamstory#product_list,PYUNKANG YUL Low pH Pore Deep Cleansing Foam 40ml / 100ml [GLAM],445 sold,9.90
1759480746-181,https://shopee.com.my/glamstory#product_list,JUMISO Waterfull Hyaluronic Acid serum 5ml / 50ml [GLAM],106 sold,45.00
1759480746-182,https://shopee.com.my/glamstory#product_list,BB LAB Low Molecular Collagen Biotin Plus (2g x 30 sticks) [GLAM],489 sold,54.45
1759480746-183,https://shopee.com.my/glamstory#product_list,BEPLAIN Mung Bean pH-Balanced Cleansing Foam 80ml,288 sold,38.00
1759480746-184,https://shopee.com.my/glamstory#product_list,PAULA'S CHOICE Skin Perfecting 2% BHA (Salicylic Acid) Liquid 10ml/30ml,744 sold,19.90
1759480746-185,https://shopee.com.my/glamstory#product_list,VT COSMETICS Cica Daily Soothing Mask (30 Sheets) 350g,5k+ sold,49.00
1759480746-186,https://shopee.com.my/glamstory#product_list,MEDICUBE Kojic Acid Tumeric / Collagen Night Wrapping Mask 75ml,259 sold,89.00
1759480746-187,https://shopee.com.my/glamstory#product_list,Etude House Soon Jung PH 5.5 / Cica Relief Toner 25ml / 80ml / 200ml / 350ml [GLAM],10k+ sold,37.00
1759480746-188,https://shopee.com.my/glamstory#product_list,NEEDS Berry Bloom Blooming Peptide Hair Tonic 70ml [GLAM],634 sold,26.90
1759480746-189,https://shopee.com.my/glamstory#product_list,ETUDE HOUSE Soon Jung pH5.5 Foam Cleanser 150ml [GLAM],10k+ sold,26.00
1759480746-190,https://shopee.com.my/glamstory#product_list,MEDICUBE PDRN Pink Peptide Serum 30ml,47 sold,69.00
1759480746-191,https://shopee.com.my/glamstory#product_list,Forever Living Absorbent C - Vitamin C [GLAM],512 sold,56.50
1759480746-192,https://shopee.com.my/glamstory#product_list,Mamonde Rose Water Toner 50ml /150ml / 250ml,10k+ sold,1.00
1759480746-193,https://shopee.com.my/glamstory#product_list,COSRX Favorites Best Seller Set (20ml) [GLAM],10k+ sold,46.52
1759480746-194,https://shopee.com.my/glamstory#product_list,APIEU Glycolic Acid Hamamelis Kalamansi Madecassoside Sea Buckthorn Cream 50ml [GLAM],3k+ sold,26.00
1759480746-195,https://shopee.com.my/glamstory#product_list,BEAUTY OF JOSEON Radiance Cleansing Balm 100ml [GLAM],3k+ sold,49.33
1759480746-196,https://shopee.com.my/glamstory#product_list,NUMBUZIN No.3 Super Glowing Essence Toner 200ml,11 sold,53.00
1759480746-197,https://shopee.com.my/glamstory#product_list,MEDICUBE Deep Vita C Daily Quick Mask 350g (30 Sheet),3 sold,69.00
1759480746-198,https://shopee.com.my/glamstory#product_list,INNISFREE Canola Honey Lip Balm / Intensive Moisture 3.5g,2k+ sold,26.00
1759480746-199,https://shopee.com.my/glamstory#product_list,INNISFREE Bija Trouble Lotion 100ml [GLAM],436 sold,47.00
1759480746-200,https://shopee.com.my/glamstory#product_list,MEDIPEEL Red Lacto Collagen Wrapping Mask 15ml / 70ml,393 sold,83.90
1759480746-201,https://shopee.com.my/glamstory#product_list,PURITO Seoul Wonder Releaf Centella Serum Unscented 15ml / 60ml,712 sold,20.00
1759480746-202,https://shopee.com.my/glamstory#product_list,SKINFOOD Acorn Pore Peptide / Yuja Vita C / Carrot Carotene Daily Mask 270g [GLAM],9k+ sold,69.00
1759480746-203,https://shopee.com.my/glamstory#product_list,LINDSAY Cool Tea-Tree/Pearl/Vitamin/Collagen/Calendula/Charcoal/Lavender/Calming Herb Modeling Mask Cup Pack 28g,3k+ sold,7.50
1759480746-204,https://shopee.com.my/glamstory#product_list,INNISFREE Tone Up No Sebum / Watering / Long Lasting / Hyaluron / Poreless Sunscreen SPF50+ PA++++ 50ml,6k+ sold,58.45
1759480746-205,https://shopee.com.my/glamstory#product_list,PAULA'S CHOICE Skin Perfecting 2% BHA (Salicylic Acid) Liquid 30ml/118ml [GLAM],2k+ sold,65.00
1759480746-206,https://shopee.com.my/glamstory#product_list,COSRX Aloe Soothing Sun Cream SPF50 PA+++ 50ml/1.2ml [GLAM],20k+ sold,29.90
1759480746-207,https://shopee.com.my/glamstory#product_list,BIODANCE Hydro Cera-Nol / Bio-Collagen / Refreshing Sea Kelp / Vita Niacinamide Real Deep Mask 34g (1Sheet),,16.00
1759480746-208,https://shopee.com.my/glamstory#product_list,ROUND LAB Birch Juice Moisturizing Cream 80 ml,62 sold,66.00
1759480746-209,https://shopee.com.my/glamstory#product_list,IUNIK Calendula Complete Cleansing Oil 25ml / 200ml [GLAM],8k+ sold,59.00
1759480746-210,https://shopee.com.my/glamstory#product_list,IUNIK Beta Glucan Daily Moisture Cream 1.5ml / 15ml / 60ml [GLAM],7k+ sold,18.00
1759480746-211,https://shopee.com.my/glamstory#product_list,HARUHARU Wonder Black Rice Moisture 5.5 Soft Cleansing Gel 100ml [GLAM],326 sold,41.00
1759480746-212,https://shopee.com.my/glamstory#product_list,TIAM VITA B3 Mist Toner 200ml / 6.76 fl.oz.,5 sold,38.00
1759480746-213,https://shopee.com.my/glamstory#product_list,TONYMOLY I'm Real Facial Mask Sheet 1 pcs TONY MOLY [GLAM],10k+ sold,2.80
1759480746-214,https://shopee.com.my/glamstory#product_list,Forever Living Omega 3 Plus 120 Softgels  [GLAM],227 sold,97.50
1759480746-215,https://shopee.com.my/glamstory#product_list,ANUA 7 Rice Ceramide Hydrating Barrier Serum 50ml,88 sold,75.00
1759480746-216,https://shopee.com.my/glamstory#product_list,INNISFREE Special Care Foot / Hand Mask 1 Sheet [GLAM],10k+ sold,11.50
1759480746-217,https://shopee.com.my/glamstory#product_list,LAMELIN Calming Moisture Mask Pack 23g (11 Types) [GLAM],784 sold,0.88
1759480746-218,https://shopee.com.my/glamstory#product_list,SOME BY MI AHA BHA PHA Miracle Calming Body Lotion 200ml,30 sold,39.90
1759480746-219,https://shopee.com.my/glamstory#product_list,MARY & MAY Idebenone Blackberry Intense / Sensitive Soothing Gel Blemish Cream 70g [GLAM],3k+ sold,48.50
1759480746-220,https://shopee.com.my/glamstory#product_list,INNISFREE Blueberry Rebalancing 5.5 Cleanser 100ml [GLAM],6k+ sold,25.00
1759480746-221,https://shopee.com.my/glamstory#product_list,SOME BY MI AHA BHA PHA 30 Days Miracle Cleansing Bar [SOMEBYMI],10k+ sold,30.08
1759480746-222,https://shopee.com.my/glamstory#product_list,COSRX Ultra-Light Invisible Sunscreen SPF50 PA++++ 50ml,74 sold,44.55
1759480746-223,https://shopee.com.my/glamstory#product_list,NUMBUZIN No.3 Radiance Glowing Jumbo Essence Pad (70EA) 150ml,52 sold,53.00
1759480746-224,https://shopee.com.my/glamstory#product_list,DR.CEURACLE Korean Vegan Kombucha Tea Gel Cream 75g / Essence 150ml [GLAM],5k+ sold,65.00
1759480746-225,https://shopee.com.my/glamstory#product_list,APIEU Honey & Milk Lip Scrub 8ml / Lip Balm 3.3g / Lip Sleeping Pack 6g / Lip Oil 5g [GLAM],2k+ sold,12.90
1759480746-226,https://shopee.com.my/glamstory#product_list,THE RAW. Daily Ceramides Gel / Cream Moisturiser 30ml / 50ml,643 sold,56.00
1759480746-227,https://shopee.com.my/glamstory#product_list,SOME BY MI AHA BHA PHA 30 Days Miracle Truecica Clear Pad [GLAM],2k+ sold,48.87
1759480746-228,https://shopee.com.my/glamstory#product_list,SOME BY MI Truecica Aqua / Mineral Calming Tone up Suncream Sunscreen 50ml SPF50+ PA++++ SOMEBYMI [GLAM],8k+ sold,45.11
1759480746-229,https://shopee.com.my/glamstory#product_list,UNOVE Deep Damage Treatment Ex (Warm Petals) 40ml [GLAM],688 sold,23.00
1759480746-230,https://shopee.com.my/glamstory#product_list,3W CLINIC Enrich Foot Treatment 100ml [GLAM],10k+ sold,5.85
1759480746-231,https://shopee.com.my/glamstory#product_list,ISNTREE Hyaluronic Acid Aqua Gel / Moist Cream 100ml [GLAM],10k+ sold,2.21
1759480746-232,https://shopee.com.my/glamstory#product_list,SNP Gold Bird's Nest Aqua / Collagen / Diamond / Black Pearl Ampoule Mask [GLAM],3k+ sold,35.95
1759480746-233,https://shopee.com.my/glamstory#product_list,THE RAW. Acne Spot Drying Solution 15ml / 30ml,167 sold,25.00
1759480746-234,https://shopee.com.my/glamstory#product_list,LAMELIN Aloe Vera / Snail Soothing Gel 300ml [GLAM],188 sold,9.60
1759480746-235,https://shopee.com.my/glamstory#product_list,HARUHARU Wonder Centella 4% TXA Dark Spot Go Away Serum 30ml,70 sold,59.30
1759480746-236,https://shopee.com.my/glamstory#product_list,W.DRESSROOM Dress & Living Clear Perfume 70ml #2 WDRESSROOM [GLAM],10k+ sold,12.90
1759480746-237,https://shopee.com.my/glamstory#product_list,Mise En Scene Hello Cream Hair Color (8MB),378 sold,29.49
1759480746-238,https://shopee.com.my/glamstory#product_list,PYUNKANG YUL Acne Facial Cleanser 120ml [GLAM],1k+ sold,25.00
1759480746-239,https://shopee.com.my/glamstory#product_list,HEVEBLUE Salmon Caring Centella Toner 200ml / Ampoule 30ml / Bubble Cleanser 200ml / Travel Kit,163 sold,79.90
1759480746-240,https://shopee.com.my/glamstory#product_list,THE RAW. SunDation Instant-Blur Matte Sun Cushion Foundation SPF50+++ 15g,1 sold,75.90
1759480746-241,https://shopee.com.my/glamstory#product_list,3W CLINIC Make Up Pearl Mist 150ml,5k+ sold,14.40
1759480746-242,https://shopee.com.my/glamstory#product_list,Forever Living Avocado Face & Body Soap [GLAM],10k+ sold,24.90
1759480746-243,https://shopee.com.my/glamstory#product_list,PURITO Centella Unscented Recovery Cream 12ml/50ml [GLAM],58 sold,10.00
1759480746-244,https://shopee.com.my/glamstory#product_list,INNISFREE Jeju Volcanic Pore Cleansing Foam 150ml [GLAM],2k+ sold,35.00
1759480746-245,https://shopee.com.my/glamstory#product_list,MEDIPEEL Ampoule Mask Hyaluron Rose /  Cica-Nol (1 Sheet) 30ml,1k+ sold,3.99
1759480746-246,https://shopee.com.my/glamstory#product_list,HARUHARU Wonder Black Rice Hyaluronic Toner 13ml / 150ml [GLAM],10k+ sold,37.90
1759480746-247,https://shopee.com.my/glamstory#product_list,DR. MELAXIN Eyephalt Eyebag Cream 10ml,80 sold,98.05
1759480746-248,https://shopee.com.my/glamstory#product_list,PYUNKANG YUL Calming Moisture Repair Balm / Cream / Low pH Foaming Cleanser / Toner / Mist / Serum / Mask [GLAM],10k+ sold,5.50
1759480746-249,https://shopee.com.my/glamstory#product_list,BB LAB  [HALAL/NORMAL] Good Night Collagen (2g x 30 sticks) [GLAM],2k+ sold,55.00
1759480746-250,https://shopee.com.my/glamstory#product_list,ARENCIA Red Smoothie / Holy Hyssop Serum 30 50g,51 sold,79.00
1759480746-251,https://shopee.com.my/glamstory#product_list,Forever Living Propolis Cream 113g [GLAM],413 sold,68.50
1759480746-252,https://shopee.com.my/glamstory#product_list,TOCOBO Juicy Berry Plumping Lip Oil 4g,47 sold,26.00
1759480746-253,https://shopee.com.my/glamstory#product_list,INNISFREE Retinol Cica Repair Ampoule 30ml [GLAM],280 sold,115.00
1759480746-254,https://shopee.com.my/glamstory#product_list,MEDIAN Advanced Dental IQ Toothpaste 93% Original / Breath Care / White / Gingivitis Prevention 120g,139 sold,9.90
1759480746-255,https://shopee.com.my/glamstory#product_list,KAINE Vegan Collagen Cream|Collagen Charging Serum|Vita Drop Serum|Rosemary Gel Cleanser|Kombu Balancing Ampoule Toner,3k+ sold,6.00
1759480746-256,https://shopee.com.my/glamstory#product_list,ANUA Heartleaf 77% Soothing Toner 500ml,33 sold,69.00
1759480746-257,https://shopee.com.my/glamstory#product_list,ZARZOU Brightening Hydrating / Repairing Soothing Serum / Hydrating Mist / Deep Cleanser /Moisturizer /Sun Gel [,10k+ sold,25.90
1759480746-258,https://shopee.com.my/glamstory#product_list,VT COSMETICS Reedle Shot 100 Application 50ml,18 sold,86.00
1759480746-259,https://shopee.com.my/glamstory#product_list,MEDICUBE PDRN Hyaluronic Moisturizing Cream 50ml,4 sold,61.00
1759480746-260,https://shopee.com.my/glamstory#product_list,ANJO Professional 24k Gold Prime Ampoule 90ml / Foam Cleansing 100ml / Radiance Essence 150ml [GLAM],1k+ sold,6.00
1759480746-261,https://shopee.com.my/glamstory#product_list,SOME BY MI AHA BHA PHA 14 Days Super Miracle Spot All Kill Cream 30ml SOMEBYMI [GLAM],3k+ sold,44.61
1759480746-262,https://shopee.com.my/glamstory#product_list,MEDICUBE Zero Pore Blackhead Deep Cleansing Oil 205ml,,58.45
1759480746-263,https://shopee.com.my/glamstory#product_list,BEAUTY OF JOSEON Dynasty Cream 50ml / 100ml [GLAM],2k+ sold,62.10
1759480746-264,https://shopee.com.my/glamstory#product_list,HARUHARU Wonder Black Rice Moisture Deep Cleansing Oil 150ml [GLAM],317 sold,60.00
1759480746-265,https://shopee.com.my/glamstory#product_list,PYUNKANG YUL Acne Spot Patch Super Thin (15EA) [GLAM],9k+ sold,6.00
1759480746-266,https://shopee.com.my/glamstory#product_list,PYUNKANG YUL Moisture Cream 100ml [GLAM],7k+ sold,67.00
1759480746-267,https://shopee.com.my/glamstory#product_list,APIEU Pure Block Natural Daily / Water-Proof / Tone Up / Aqua Sun Cream Sun Base SPF50 PA+++ 50ml [GLAM],3k+ sold,26.00
1759480746-268,https://shopee.com.my/glamstory#product_list,MEDICUBE PDRN Pink Peptide Eye Cream 30ml,5 sold,65.00
1759480746-269,https://shopee.com.my/glamstory#product_list,ANUA Peach 77 Niacin Enriched Cream 50ml / Conditioning Milk 150ml / Essence Toner 250ml / Serum 30ml [GLAM],184 sold,39.90
1759480746-270,https://shopee.com.my/glamstory#product_list,MISSHA All Around Safe Block Essence Sun / Aqua Sun Gel / Cotton / Daily Sun Sunscreen 50ml [GLAM],780 sold,26.00
1759480746-271,https://shopee.com.my/glamstory#product_list,ETUDE Sunprise Mild Watery Light Sunscreen SPF 50+ PA++++ 50g,29 sold,35.65
1759480746-272,https://shopee.com.my/glamstory#product_list,MARY & MAY Centella Asiatica / Niacinamide + Chaenomeles Sinensis / Tea Tree / Idebenone + Blackberry Serum,814 sold,29.90
1759480746-273,https://shopee.com.my/glamstory#product_list,TIA'M Snail & Azulene Low pH Cleanser / Sleeping Mask / Water Essence TIAM [GLAM],234 sold,26.00
1759480746-274,https://shopee.com.my/glamstory#product_list,ETUDE HOUSE Soon Jung pH 6.5 Whip Cleanser 150ml / 250ml [GLAM],7k+ sold,33.00
1759480746-275,https://shopee.com.my/glamstory#product_list,JUMISO All day Vitamin Brightening & Balancing Facial Serum 5ml / 30ml [GLAM],10k+ sold,44.99
1759480746-276,https://shopee.com.my/glamstory#product_list,BEAUTY OF JOSEON Low pH Rice Face and Body Cleansing Bar 100g [GLAM],63 sold,29.90
1759480746-277,https://shopee.com.my/glamstory#product_list,BEAUTY OF JOSEON Relief Sun : Rice + Probiotics SPF50+ PA++++ 1ml SAMPLE / Dynasty Cream 1ml SAMPLE,418 sold,1.00
1759480746-278,https://shopee.com.my/glamstory#product_list,BEAUTY OF JOSEON Green Plum Refreshing Cleanser 100ml [GLAM],1k+ sold,34.02
1759480746-279,https://shopee.com.my/glamstory#product_list,MEDICUBE Zero Foam Cleanser 120g,14 sold,46.00
1759480746-280,https://shopee.com.my/glamstory#product_list,INNISFREE ACTIVE MASK 25ml,6k+ sold,6.00
1759480746-281,https://shopee.com.my/glamstory#product_list,ANUA BHA 2% Gentle Exfoliating Toner 150ml,3k+ sold,69.00
1759480746-282,https://shopee.com.my/glamstory#product_list,MARY & MAY Cica TeaTree Soothing / Lemon Niacinamide Glow/ Rose Hyaluronic Hydra Wash off Pack 30g / 125g [GLAM],141 sold,9.90
1759480746-283,https://shopee.com.my/glamstory#product_list,DR. MELAXIN Exosome Repair Cream 50ml,1 sold,59.00
1759480746-284,https://shopee.com.my/glamstory#product_list,HOUSE OF HUR Brightening / Clearing Skin Prep Essence Pad (70 Pads) 140ml [GLAM],133 sold,55.00
1759480746-285,https://shopee.com.my/glamstory#product_list,SKINFOOD Rice Brightening Pad / Potato Madecassoside Soothing 250g [60Pads],5 sold,64.35
1759480746-286,https://shopee.com.my/glamstory#product_list,K-SECRET SEOUL 1988 Cream: Retinal Liposome 1% + Fermented Rice 50ml,2 sold,79.20
1759480746-287,https://shopee.com.my/glamstory#product_list,PYUNKANG YUL Intensive Repair Cream 50ml [GLAM],170 sold,53.00
1759480746-288,https://shopee.com.my/glamstory#product_list,BENTON Deep Green Tea Cleansing Foam 120g / Toner 150mL [GLAM],5k+ sold,22.00
1759480746-289,https://shopee.com.my/glamstory#product_list,COSRX Aloe 54.2 Aqua Tone-up Sunscreen SPF 50+ PA++++ 50ml [GLAM],3k+ sold,36.00
1759480746-290,https://shopee.com.my/glamstory#product_list,SOME BY MI Lacto soy Mild Peeling Bubble Cleanser 180ml / Serbum & Blackhead Cleansing Oil 200ml / Cleansing Bar 90g,14 sold,52.50
1759480746-291,https://shopee.com.my/glamstory#product_list,JM SOLUTION Luminous Water Honey Marine Glow Active Moisturising Nourishing Brightening Vital Ampoule Mask (BOX),2k+ sold,29.90
1759480746-292,https://shopee.com.my/glamstory#product_list,INNISFREE Green Tea Hyaluronic Skin 170ml [GLAM],187 sold,57.39
1759480746-293,https://shopee.com.my/glamstory#product_list,SOME BY MI AHA BHA PHA 30 Days Miracle Acne Clear Body Cleanser 400g SOMEBYMI [GLAM],10k+ sold,9.90
1759480746-294,https://shopee.com.my/glamstory#product_list,PYUNKANG YUL Acne Cream 50ml [GLAM],203 sold,36.00
1759480746-295,https://shopee.com.my/glamstory#product_list,HEIMISH Bulgarian Rose Water Hydrogel Eye Patch 60pcs [GLAM],10k+ sold,39.90
1759480746-296,https://shopee.com.my/glamstory#product_list,GOODAL Green Tangerine Vita C Dark Spot Care Serum 40ml /30ml [GLAM],644 sold,75.00
1759480746-297,https://shopee.com.my/glamstory#product_list,THE RAW. Cera-Shield Physical / Chemical / Hybrid / Aqua Sunscreen SPF 50+ PA+++ 30g,78 sold,42.60
1759480746-298,https://shopee.com.my/glamstory#product_list,PYUNKANG YUL Cotton Pad 1/3 (160pcs) [GLAM],1k+ sold,14.00
1759480746-299,https://shopee.com.my/glamstory#product_list,HARUHARU Wonder Black Rice Hyaluronic Toner For Sensitive Skin 150ml [GLAM],271 sold,41.00
1759480746-300,https://shopee.com.my/glamstory#product_list,COSRX Centella Blemish Cream 30ml [GLAM],4k+ sold,39.90
1759480746-301,https://shopee.com.my/glamstory#product_list,SOME BY MI Bye Bye Blackhead / Blemish / Charcoal BHA Pore Clay Bubble Mask 120g SOMEBYMI [GLAM],1 sold,45.00
1759480746-302,https://shopee.com.my/glamstory#product_list,LINDSAY Premium Modeling Mask Powder Pack 1kg,960 sold,61.50
1759480746-303,https://shopee.com.my/glamstory#product_list,COSRX Galactomyces 95 Tone Balancing Essence 100ml [GLAM],4k+ sold,39.90
1759480746-304,https://shopee.com.my/glamstory#product_list,TOCOBO Cotton Soft Sun Stick 19g / Bio Watery / Vita Tone Up Sun Cream SPF50+ PA++++ 10ml / 50ml [GLAM],1k+ sold,5.80
1759480746-305,https://shopee.com.my/glamstory#product_list,THE RAW. Micellar Pad Alcohol Free Makeup Remover (15 Pads) 30g,35 sold,19.00
1759480746-306,https://shopee.com.my/glamstory#product_list,BB LAB Low Molecular Collagen 5000 Mix Berry Flavouring (6.5g x 15 Sticks),137 sold,58.00
1759480746-307,https://shopee.com.my/glamstory#product_list,ISNTREE Green Tea Fresh Toner / Serum / Cleanser 50ml 120ml 200ml [GLAM],9k+ sold,33.90
1759480746-308,https://shopee.com.my/glamstory#product_list,INNISFREE Green Tea Hyaluronic Lotion 170ml,101 sold,58.00
1759480746-309,https://shopee.com.my/glamstory#product_list,INNISFREE Apple Seed Cleansing Cream /  Soft Cleansing Foam / Cleansing Oil / Tissue / Lip Eye Makeup Remover [GLAM],4k+ sold,25.00
1759480746-310,https://shopee.com.my/glamstory#product_list,BB LAB Intensive Low Molecular / Glutathione Collagen S (2g x 30 sticks),643 sold,79.00
1759480746-311,https://shopee.com.my/glamstory#product_list,TONYMOLY Fresh To Go Mask Sheet (1 Sheet) TONY MOLY [GLAM],249 sold,3.00
1759480746-312,https://shopee.com.my/glamstory#product_list,DR. ALTHEA Green Relief Amino Gel Cleanser 100ml,8 sold,55.00
1759480746-313,https://shopee.com.my/glamstory#product_list,Isntree Hyaluronic Acid Cream / Sun Gel Samples 1PC,5k+ sold,1.00
1759480746-314,https://shopee.com.my/glamstory#product_list,Forever Living Bee Pollen [GLAM],179 sold,56.60
1759480746-315,https://shopee.com.my/glamstory#product_list,ROUND LAB Camellia Deep Collagen Firming Gel Mask 34g (1 SHEET),4 sold,13.00
1759480746-316,https://shopee.com.my/glamstory#product_list,BENTON Snail Bee High Content Essence 1ml / 15ml / 60ml / 100ml [GLAM],10k+ sold,42.03
1759480746-317,https://shopee.com.my/glamstory#product_list,COSRX Acne Hero Kit Intensive / Mild / All About Snail 4 Step / Cica-7 Relief / Honey Glow Travel Kit [GLAM],5k+ sold,39.90
1759480746-318,https://shopee.com.my/glamstory#product_list,PYUNKANG YUL Acne Toner 150ml [GLAM],2k+ sold,34.50
1759480746-319,https://shopee.com.my/glamstory#product_list,KAINE Kombu Balancing Ampoule Toner 30ml / 150ml,780 sold,9.90
1759480746-320,https://shopee.com.my/glamstory#product_list,ISNTREE Ultra-Low Molecular Hyaluronic Acid Toner Plus 200ml / 300ml [GLAM],198 sold,52.00
1759480746-321,https://shopee.com.my/glamstory#product_list,ABIB Mild Acidic pH Sheet Mask 30ml / Gummy Sheet Mask 27ml [GLAM],4k+ sold,5.99
1759480746-322,https://shopee.com.my/glamstory#product_list,HYAAH Mild But Deep Cleansing Water 300ml,7 sold,58.45
1759480746-323,https://shopee.com.my/glamstory#product_list,W.DRESSROOM Deodorant Diffuser 110g [GLAM],629 sold,9.90
1759480746-324,https://shopee.com.my/glamstory#product_list,JUMISO Pore Clearing Cleansing Oil 200ml,15 sold,49.40
1759480746-325,https://shopee.com.my/glamstory#product_list,Mary & May Believe in truth VEGAN serum 80ml [SEOUL EDITION],23 sold,49.00
1759480746-326,https://shopee.com.my/glamstory#product_list,NUMBUZIN No.3 Skin Softening Serum 50ml,25 sold,66.00
1759480746-327,https://shopee.com.my/glamstory#product_list,TIAM VITA A Bakuchiol Youth Serum 40ml/1.35 FL.OZ.,8 sold,42.60
1759480746-328,https://shopee.com.my/glamstory#product_list,VT COSMETICS Cica Mild Toner Pad (60EA) 130ml,4 sold,36.00
1759480746-329,https://shopee.com.my/glamstory#product_list,COSRX Hyaluronic Acid Intensive Cream 100ml [GLAM],2k+ sold,47.90
1759480746-330,https://shopee.com.my/glamstory#product_list,PYUNKANG YUL Nutrition Cream 20ml / 100ml [GLAM],572 sold,75.00
1759480746-331,https://shopee.com.my/glamstory#product_list,PYUNKANG YUL Acne Spot Cream 15ml [GLAM],645 sold,35.00
1759480746-332,https://shopee.com.my/glamstory#product_list,SOME BY MI Propolis B5 Glow Barrier Calming Serum 50ml / Toner 150ml / Cream 60g / Mask 100g / Oil To Foam 120ml / Kit,6k+ sold,52.43
1759480746-333,https://shopee.com.my/glamstory#product_list,KAINE Rosemary Relief Gel Cleanser 150ml / 30ml / 1.5ml,11 sold,9.90
1759480746-334,https://shopee.com.my/glamstory#product_list,AXIS-Y Spot the Difference Blemish Treatment 15ml [GLAM],10k+ sold,42.00
1759480746-335,https://shopee.com.my/glamstory#product_list,NAAP Mask Pack 5 Types - 27g (1sheet),124 sold,1.60
1759480746-336,https://shopee.com.my/glamstory#product_list,BEAUTY OF JOSEON Green Plum Refreshing Toner : AHA + BHA 150ml [GLAM],595 sold,46.78
1759480746-337,https://shopee.com.my/glamstory#product_list,HARUHARU Wonder Black Rice Moisture Airy Fit / Black Rice Pure Mineral Relief Daily Sunscreen SPF50+ PA++++ 50ml [GLAM],235 sold,55.00
1759480746-338,https://shopee.com.my/glamstory#product_list,HOUSE OF HUR Purifying Cleansing Balm 50ml,18 sold,66.00
1759480746-339,https://shopee.com.my/glamstory#product_list,Forever Living Bright Toothgel [GLAM],3 sold,30.90
1759480746-340,https://shopee.com.my/glamstory#product_list,HEIMISH pH5.5 All Clean Green Foam 2ml/ 30ml/ 150ml [GLAM],9k+ sold,25.00
1759480746-341,https://shopee.com.my/glamstory#product_list,ANUA PDRN Hyaluronic Acid Capsule 100 Serum 30ml,28 sold,59.90
1759480746-342,https://shopee.com.my/glamstory#product_list,PYUNKANG YUL Low pH Cleansing Water 290ml [GLAM],8 sold,33.90
1759480746-343,https://shopee.com.my/glamstory#product_list,PYUNKANG YUL Moisture Serum 9ml / 100ml [GLAM],185 sold,63.00
1759480746-344,https://shopee.com.my/glamstory#product_list,BENTON Air Fit UV Defense Sun Cream / Skin Fit Mineral Sun Cream / CICA Gel Sunscreen Serum,1k+ sold,8.80
1759480746-345,https://shopee.com.my/glamstory#product_list,Teddi Lab By Unichi Hair Boost Gummy 180g [60 Gummies],415 sold,98.05
1759480746-346,https://shopee.com.my/glamstory#product_list,BENTON Deep Green Tea Toner 2ml / 30ml / 150ml [GLAM],1k+ sold,41.48
1759480746-347,https://shopee.com.my/glamstory#product_list,LAMELIN Hyaluronic / Cica / Collagen BB Sun Cream SPF50+ PA++++ 70ml [GLAM],128 sold,8.80
1759480746-348,https://shopee.com.my/glamstory#product_list,SECRET KEY Snow White Milky Lotion 120g / Cream 50g / Pack 200g [GLAM],2k+ sold,35.00
1759480746-349,https://shopee.com.my/glamstory#product_list,TIAM Surprise B Patch [7mm x 10ea + 10mm x 5ea + 12mm X 9ea] / Surprise H Patch [10mm x 18ea],11 sold,8.80
1759480746-350,https://shopee.com.my/glamstory#product_list,ETUDE HOUSE Soon Jung Hydro Barrier Cream 75ml [GLAM],156 sold,58.45
1759480746-351,https://shopee.com.my/glamstory#product_list,BB LAB 30days Miracle Beauty Pack (5 tablets x 30 packs/Box),1 sold,186.00
1759480746-352,https://shopee.com.my/glamstory#product_list,ETUDE HOUSE Lip & Eye Remover 25ml / 100ml [GLAM],253 sold,17.00
1759480746-353,https://shopee.com.my/glamstory#product_list,BENTON Goodbye Redness Centella Mask Pack (1 Sheet) [GLAM],1k+ sold,5.00
1759480746-354,https://shopee.com.my/glamstory#product_list,FOREVER LIVING Aloe Sunscreen Broad Spectrum SPF 30 Water Resistant 118ml,4 sold,50.00
1759480746-355,https://shopee.com.my/glamstory#product_list,COSRX BHA Blackhead Liquid Toner 100ml [GLAM],5k+ sold,44.00
1759480746-356,https://shopee.com.my/glamstory#product_list,BENTON Pore Clear Brush [GLAM],87 sold,33.90
1759480746-357,https://shopee.com.my/glamstory#product_list,PYUNKANG YUL Cleansing Foam 150ml [GLAM],6k+ sold,35.00
1759480746-358,https://shopee.com.my/glamstory#product_list,JUMISO All Day Vitamin Pure C 5.5 Glow / VC-IP 1.0 Firming Serum 30ml [GLAM],547 sold,49.00
1759480746-359,https://shopee.com.my/glamstory#product_list,Forever Living FLP Bee Honey [GLAM],5k+ sold,99.90
1759480746-360,https://shopee.com.my/glamstory#product_list,ARENCIA Rice Mucin Glow / Red Smoothie / Holy Hyssop Serum 30ml,,66.00
1759480746-361,https://shopee.com.my/glamstory#product_list,HEIMISH Moringa Ceramide Collagen Enriched Moisturizer 120ml / Hyaluronic Hydrating Cream 50ml / Watery Sunscreen 50ml,29 sold,39.90
1759480746-362,https://shopee.com.my/glamstory#product_list,VT COSMETICS Reedle Shot 100 2Step Hydrogel Mask 33g / Mask 25g,304 sold,6.90
1759480746-363,https://shopee.com.my/glamstory#product_list,MISSHA Airy Fit Sheet Mask 19g (1 Sheet) [GLAM],4k+ sold,2.80
