web-scraper-order,web-scraper-start-url,Name,Units Sold,Price
1759721426-613,https://shopee.co.th/multyshopping#product_list,Baby Bright Glowy Peach Contour Palette 4 g.X 3 Colors,2 sold,159
1759721426-614,https://shopee.co.th/multyshopping#product_list,GRN+ Pocket Do Pink Label อาหารเสริมเกาหลี วิตามินจองกุก,,129
1759721426-615,https://shopee.co.th/multyshopping#product_list,Alese Extra White Body Milk Serum 150 ml.,,390
1759721426-616,https://shopee.co.th/multyshopping#product_list,Mizumi Uv Bright Body Serum 120 g.กันแดดโทนอัพปรับผิว,32 sold,390
1759721426-617,https://shopee.co.th/multyshopping#product_list,Skintific 3X Acid Acne Gel Cleanser 120 ml.คลีนเซอร์สำหรับคนเป็นสิว,4 sold,299
1759721426-618,https://shopee.co.th/multyshopping#product_list,Cathy Doll Get Set Go Browcara 3.2 g.,104 sold,139
1759721426-619,https://shopee.co.th/multyshopping#product_list,Physiogel-Acne Care Clearing Foam Cleanser 120ml.,1 sold,540
1759721426-620,https://shopee.co.th/multyshopping#product_list,Round Lab Soybean serum 50ml เซรั่มถั่ว บำรุงเข้มข้น ชุ่มชื้น เนื้อ Moisturizing capsule,32 sold,650
1759721426-621,https://shopee.co.th/multyshopping#product_list,Dinto Pearl Kissed Plumping Lip Glacé,9 sold,440
1759721426-622,https://shopee.co.th/multyshopping#product_list,Leaves Natural Vit C Soothing Gel 300ml.,31 sold,250
1759721426-623,https://shopee.co.th/multyshopping#product_list,Dr.G 8X Retinol Pink Peptide Booster Serum 30 ml.เซรั่มเรตินอลเปปไทด์ บูสวอลุ่มผิว กระตุ้นคอลลาเจน,2 sold,590
1759721426-624,https://shopee.co.th/multyshopping#product_list,Gentle Colors Tint Oil 4.5g ลิปทิ้นต์ออยล์ เนื้อฉ่ำ,12 sold,490
1759721426-625,https://shopee.co.th/multyshopping#product_list,SO GLAM GLAZING TINT BALM ลิปทิ้นต์บาล์ม,,299
1759721426-626,https://shopee.co.th/multyshopping#product_list,Mille-Rose Cordy Pomegranate Booster Serum 6g. เซรั่มน้ำโสมกุหลาบถั่งเช่า,3 sold,69
1759721426-627,https://shopee.co.th/multyshopping#product_list,Sasi Perfect Personal Color Blush 3.5 g. บลัชออนเนื้อบางเบา,16 sold,149
1759721426-628,https://shopee.co.th/multyshopping#product_list,4U2 Basic Brow Powder 2.25 g. พาเลทคิ้วฝุ่น 3 เฉดสี,45 sold,299
1759721426-629,https://shopee.co.th/multyshopping#product_list,MizuMi Waterful Sun Pact SPF50+ PA++++ 10g.กันแดดคุชชั่น,3 sold,790
1759721426-630,https://shopee.co.th/multyshopping#product_list,Odbo Black-Brown Duo Gel Liner 0.2 g.,9 sold,189
1759721426-631,https://shopee.co.th/multyshopping#product_list,Skintific Cover All Perfect Cushion 11 g. New shades สีใหม่,39 sold,449
1759721426-632,https://shopee.co.th/multyshopping#product_list,Beauty Of Joseon Light On Serum Centella+Vita C 30ml.,12 sold,690
1759721426-633,https://shopee.co.th/multyshopping#product_list,Kage Fluffy Cloud Corrector Peach 6.5 ml.คอนซีลเลอร์เนื้อบางเบา,5 sold,249
1759721426-634,https://shopee.co.th/multyshopping#product_list,Lip It Feel'in Good Lip Mask Stick 5.5 g. ลิปมาสก์สติ๊ก,42 sold,229
1759721426-635,https://shopee.co.th/multyshopping#product_list,Raburabu Natural Cleansing Water คลีนซิ่ง เช็ดเครื่องสำอาง สูตรน้ำ อ่อนโยน,5 sold,109
1759721426-636,https://shopee.co.th/multyshopping#product_list,ODBO PRO COVER CONCEALER 2.5 g.คอนซีลเลอร์,1 sold,189
1759721426-637,https://shopee.co.th/multyshopping#product_list,Nu Formula Ultra Protection Sun Spray Real SPF50+ PA++++ 100 ml.,6 sold,459
1759721426-638,https://shopee.co.th/multyshopping#product_list,Ran Instyle Cushion 7 g. คุชชั่นรันแบบซอง,759 sold,59
1759721426-639,https://shopee.co.th/multyshopping#product_list,Odbo Lash Up Waterproof Mascara 4.5 g.,15 sold,339
1759721426-640,https://shopee.co.th/multyshopping#product_list,Med B Youth X2 Retinol Eye Cream 30 ml.,3 sold,670
1759721426-641,https://shopee.co.th/multyshopping#product_list,Judydoll Liquid Eyeshadow 3 g. อายแชร์โดว์กลิตเตอร์,4 sold,269
1759721426-642,https://shopee.co.th/multyshopping#product_list,W.DRESSSROOM Moisturizing Perfume Hand Cream,3 sold,370
1759721426-643,https://shopee.co.th/multyshopping#product_list,MLEN DIARY Lazy Lashes Series 5 Rows ขนตาปลอม ขนตา DIY,10 sold,498
1759721426-644,https://shopee.co.th/multyshopping#product_list,Odid Milk protein Intensive Hair Oil 100ml. แฮร์ออยล์บำรุงผม,20 sold,650
1759721426-645,https://shopee.co.th/multyshopping#product_list,Baby Bright Ginger Tiny Brow 0.06g.+1g.,2 sold,109
1759721426-646,https://shopee.co.th/multyshopping#product_list,Baby Bright High C Serum Foundation Spf50+Pa+++ 30 g.รองพื้นผสมกันแดด,3 sold,210
1759721426-647,https://shopee.co.th/multyshopping#product_list,Odbo Auto Slim Eyebrow ดินสอเขียนคิ้ว,18 sold,149
1759721426-648,https://shopee.co.th/multyshopping#product_list,Dr.G R.E.D Blemish Clear Soothing Active Essence เอสเซนส์ น้ำตบ สำหรับผิวแพ้ง่าย,3k+ sold,590
1759721426-649,https://shopee.co.th/multyshopping#product_list,Meilinda Creamy Blending Concealer 4 ml.,3 sold,199
1759721426-650,https://shopee.co.th/multyshopping#product_list,Odbo Daily Water Tint 3 g.ลิปทิ้นท์เนื้อน้ำฉ่ำวาว,,129
1759721426-651,https://shopee.co.th/multyshopping#product_list,Judydoll Sun Defense Tinted Moisturizer 40 g. ทิ้นต์มอยซ์กันแดด,45 sold,699
1759721426-652,https://shopee.co.th/multyshopping#product_list,Cetaphil Hydra Foaming Cream Clrs 236ml.,27 sold,500
1759721426-653,https://shopee.co.th/multyshopping#product_list,Odbo Spell Recipe Eye Color Palette 7 g.,17 sold,149
1759721426-654,https://shopee.co.th/multyshopping#product_list,Benice Grape Exo Bright Shower Gel 450ml Refill ถุงเติม,2 sold,179
1759721426-655,https://shopee.co.th/multyshopping#product_list,beWilD Rock A Lash Mascara มาสคาร่า,,229
1759721426-656,https://shopee.co.th/multyshopping#product_list,Colorgram Milk Bling Heartlighter (04 Lavender Heart),22 sold,290
1759721426-657,https://shopee.co.th/multyshopping#product_list,S Nature Aqua Squalane Serum 50ml. เซรั่มปลอบประโลมผิว เติมความชุ่มชื้น,23 sold,750
1759721426-658,https://shopee.co.th/multyshopping#product_list,Nu Formula Whitening Spotless Ampoule Serum 30 ml.,15 sold,459
1759721426-659,https://shopee.co.th/multyshopping#product_list,ODBO CONTOUR X HIGHLIGHT DUO STICK 2.4 G. คอนทัวร์และไฮไลท์แบบแท่ง 2 in 1,7 sold,159
1759721426-660,https://shopee.co.th/multyshopping#product_list,Ashley Non Stick Cup Lip Glaze 2.2 ml.,3 sold,199
1759721426-661,https://shopee.co.th/multyshopping#product_list,Srichand Lip Balm Mu 26 g.ศรีจันทร์ ลิป บาล์ม เอ็มยู,6 sold,109
1759721426-662,https://shopee.co.th/multyshopping#product_list,Skin1004 Madagascar Centella Watergel Sheet Ampoule Mask 25 ml. (1กล่อง 5ชิ้น),221 sold,390
1759721426-663,https://shopee.co.th/multyshopping#product_list,4U2-Skin Everyday Tone Up Uv Gel Spf 50+ Pa++++ 30ml.,393 sold,399
1759721426-664,https://shopee.co.th/multyshopping#product_list,Odbo Sun Smiles UV Protection Spray SPF50 PA++ 75 ml.,6 sold,189
1759721426-665,https://shopee.co.th/multyshopping#product_list,Alese Premium Horse Oil & Snail White Cream 30 g.,3 sold,990
1759721426-666,https://shopee.co.th/multyshopping#product_list,Supershades Brush แปรงแต่งหน้า,18 sold,99
1759721426-667,https://shopee.co.th/multyshopping#product_list,Baby Bright 5 Oils Vegan Lip Treatment 2.5 g.,2 sold,109
1759721426-668,https://shopee.co.th/multyshopping#product_list,Srichand-Feelin Me Matte Liquid Lip ลิปแมทเนื้อลิควิด,243 sold,99
1759721426-669,https://shopee.co.th/multyshopping#product_list,Parmayard Perfume Balm 7 g. บาล์มน้ำหอม,19 sold,159
1759721426-670,https://shopee.co.th/multyshopping#product_list,Smousse Silky Hair Leave In Foam 100 ml.สมูส ซิลค์กี้ แฮร์ ลีฟ-อินโฟม มาชเมลโล่วดรีม,,410
1759721426-671,https://shopee.co.th/multyshopping#product_list,MEILINDA Ballerina Basic Brush No.03-07 แปรงแต่งหน้า,21 sold,159
1759721426-672,https://shopee.co.th/multyshopping#product_list,Skintific Lactic Acid Skin Renewal Exfoliating Serum 20 ml.,1 sold,399
1759721426-673,https://shopee.co.th/multyshopping#product_list,Axis-y Heartleaf My Type Calming Cream 60 ml.,11 sold,659
1759721426-674,https://shopee.co.th/multyshopping#product_list,Papa Recipe Blemish Cleansing Oil 120 ml. คลีนซิ่งออยล์เนื้อบางเบา,6 sold,590
1759721426-675,https://shopee.co.th/multyshopping#product_list,4U2 Skin Highlight Balm Stick 7.3 g. ไฮไลท์เนื้อบาล์มแบบแท่ง,450 sold,299
1759721426-676,https://shopee.co.th/multyshopping#product_list,Gentle Colors Fixing Spray 30 ml. สเปรย์ล็อคเมคอัพ,2 sold,390
1759721426-677,https://shopee.co.th/multyshopping#product_list,Canmake-Silky Souffle Eyes (MatteType) อายแชโดว์เนื้อซูเฟล่ แบบเชียร์แมท เนื้อนุ่มละมุน,27 sold,390
1759721426-678,https://shopee.co.th/multyshopping#product_list,I'm From Rice Cream 50g. ครีมข้าวแอมฟอร์ม,3 sold,"1,050"
1759721426-679,https://shopee.co.th/multyshopping#product_list,Skintific White Truffle Cleansing Essence 80ml. คลีนซิ่งเอสเซ้นส์ ทำความสะอาดผิวหน้า,7 sold,199
1759721426-680,https://shopee.co.th/multyshopping#product_list,Canmake Color Mixing Concealer 4.5 g.,1 sold,380
1759721426-681,https://shopee.co.th/multyshopping#product_list,Peripera Ink All Black Cara 7 g. มาสคาร่าสูตรเจล,,599
1759721426-682,https://shopee.co.th/multyshopping#product_list,Peripera Ink Glasting Lip Gloss 4.5 g. ลิปกลอส,2 sold,459
1759721426-683,https://shopee.co.th/multyshopping#product_list,JudyDoll Watery Lip Gloss 2.4 g. ลิปกลอส ฉ่ำวาว,95 sold,339
1759721426-684,https://shopee.co.th/multyshopping#product_list,Peripera.C-All Take Mood Palatte (Lucky Lottery) พาเลทตา เนื้อแมทท์ ชิมเมอร์,2 sold,801
1759721426-685,https://shopee.co.th/multyshopping#product_list,Barenbliss Roll To High Mascara 8 g.,1 sold,299
1759721426-686,https://shopee.co.th/multyshopping#product_list,Meilinda Glassy Glow Shadow Stick 1.5 g.,30 sold,199
1759721426-687,https://shopee.co.th/multyshopping#product_list,Canmake Petit Palatte Eyes (MatteType) 2 g.,9 sold,490
1759721426-688,https://shopee.co.th/multyshopping#product_list,KIKI&CO Bouncy Comb 289 g. หวีไนลอนผสมขนหมูป่า,6 sold,289
1759721426-689,https://shopee.co.th/multyshopping#product_list,Kage Grey Blush Blend 4.2 g.บลัชออน,2 sold,249
1759721426-690,https://shopee.co.th/multyshopping#product_list,BrowIt C- Highlight and Contour Pro Palette 14 g.,9 sold,590
1759721426-691,https://shopee.co.th/multyshopping#product_list,Glory Glowy Glowy Popping Balm 3.7g. ลิปบาล์ม มีสี ฉ่ำวาว,9 sold,325
1759721426-692,https://shopee.co.th/multyshopping#product_list,Cezanne 3D Jelly Lip 5 g. ลิปเจลลี่่,3 sold,290
1759721426-693,https://shopee.co.th/multyshopping#product_list,Judydoll Auto Define Eyebrow Pencil 0.08 g.,24 sold,275
1759721426-694,https://shopee.co.th/multyshopping#product_list,Dinto Be My Wendy Marshmallow & Melting Blusher,4 sold,495
1759721426-695,https://shopee.co.th/multyshopping#product_list,Chubby Glow Up Treatment Essence 50 g. น้ำตบ ปลุกผิวเปล่งปลั่งด้วยสารสกัดอาหารผิวชั้นดี,1 sold,390
1759721426-696,https://shopee.co.th/multyshopping#product_list,Odbo Magic Touch Hair Shadow 3 g.,77 sold,189
1759721426-697,https://shopee.co.th/multyshopping#product_list,Cathy Doll Shake To Shine Eye Shimmer 0.5 g.,6 sold,259
1759721426-698,https://shopee.co.th/multyshopping#product_list,Baby Bright Barrier Matte Lip Click 1.4 g.,,99
1759721426-699,https://shopee.co.th/multyshopping#product_list,Beauty Of Joseon Green Plum Refreshing Cleanser 100 ml. คลีนเซอร์,19 sold,590
1759721426-700,https://shopee.co.th/multyshopping#product_list,Srichand Barrier Boost Essence 150 ml.เอสเซ้นส์ น้ำตบ,2 sold,369
1759721426-701,https://shopee.co.th/multyshopping#product_list,Rabu Rabu Glossy Lip ลิปสติก 6 แบบ 6 สไตล์,3 sold,99
1759721426-702,https://shopee.co.th/multyshopping#product_list,Dr.G R.E.D Blemish Bakuchiol Pore Jet Cream 50 ml. ครีมกระชับรูขุมขน,1 sold,"1,290"
1759721426-703,https://shopee.co.th/multyshopping#product_list,KIKI&CO Wet Brush 249 g. หวีแกน 3 ระดับ สำหรับใช้หวีขณะผมเปียก,37 sold,249
1759721426-704,https://shopee.co.th/multyshopping#product_list,Odbo Glossy Glow Tint 2.5 g. ลิปกลอสทิ้นต์,3 sold,129
1759721426-705,https://shopee.co.th/multyshopping#product_list,Dagoderma Penta Peptide Anti Acne Ampoule Serum 30 ml.,,599
1759721426-706,https://shopee.co.th/multyshopping#product_list,About Tone Fluffy Wear Blusher 4.3 g. บลัชออน,63 sold,299
1759721426-707,https://shopee.co.th/multyshopping#product_list,Mixsoon Bean Cream 50 ml.ครีมบำรุงผิวหน้า สารสกัดถั่วเหลือง,1 sold,"1,090"
1759721426-708,https://shopee.co.th/multyshopping#product_list,Canmake-Petit Palette Eyes แคนเมค พาเลทตา มินิอายแชโดว์ 8 เฉดสี,372 sold,490
1759721426-709,https://shopee.co.th/multyshopping#product_list,CUTE PRESS BUTTER BETTER PLUMPING LIP TINT GEL SPF 40 PA++++ ลิปบัตเตอร์เนื้อเจลแนบสนิทเป็นเนื้อเดียวกับริมฝีปาก,43 sold,199
1759721426-710,https://shopee.co.th/multyshopping#product_list,RAN COSMETIC Aqua Smooth UV Defense Serum SPF 50+ PA++++ รัน คอสเมติก กันแดดเซรั่ม สูตรไฮบริด 30ml,4 sold,390
1759721426-711,https://shopee.co.th/multyshopping#product_list,Skinoxy Pro Cleanser 220 ml. คลีนเซอร์,,299
1759721426-712,https://shopee.co.th/multyshopping#product_list,Srichand Perfect Skin Matte Primer15 G. ไพร์มเมอร์,5 sold,199
1759721426-713,https://shopee.co.th/multyshopping#product_list,JudyDoll Watery Glow Lipstick 3 g. ลิปบำรุงปาก เนื้อลิปบางเบา ไม่เหนียวเหนอะหนะ,56 sold,375
1759721426-714,https://shopee.co.th/multyshopping#product_list,Odid Milk protein Intensive No Wash Ampoule Treatment 200ml. ทรีทเมนท์บำรุงผม,30 sold,530
1759721426-715,https://shopee.co.th/multyshopping#product_list,Rabu rabu Lip Oil 4 g. ลิปออยล์,10 sold,290
1759721426-716,https://shopee.co.th/multyshopping#product_list,Banobagi-Vita Genic Jelly Mask 30ml.,3k+ sold,92
1759721426-717,https://shopee.co.th/multyshopping#product_list,Dr.G Pore Blur Up Sun Spf50+ Pa++++ 50 ml. กันแดดสีม่วง,7 sold,"1,090"
1759721426-718,https://shopee.co.th/multyshopping#product_list,Skintific Light Serum Sunscreen Spf50Pa++++ 25 ml.,1 sold,269
1759721426-719,https://shopee.co.th/multyshopping#product_list,Ashley 9 Colors Eyeshadow 8.4 g. อายแชโดว์ 9 เฉดสี,10 sold,329
1759721426-720,https://shopee.co.th/multyshopping#product_list,Sasi Clicky Tint Balm 1.8 g ลิปทินต์บาล์ม แท่งกด,1 sold,189
1759721426-721,https://shopee.co.th/multyshopping#product_list,Dr.G R.E.D Blemish Soothing Up Sun [Value Set] กันแดดมอยส์เจอร์,2 sold,810
1759721426-722,https://shopee.co.th/multyshopping#product_list,Leaves Natural-Moisture Bright Sunscreen SPF50+,7 sold,590
1759721426-723,https://shopee.co.th/multyshopping#product_list,Mizumi Advance Hya Rescue Concentrate Serum 30 ml.,1 sold,890
1759721426-724,https://shopee.co.th/multyshopping#product_list,Rabu Rabu-Natural Cleansing Water 300ml.,,490
1759721426-725,https://shopee.co.th/multyshopping#product_list,Dr.G Royal Black Snail Eye Cream 30 Ml อายครีม,8 sold,990
1759721426-726,https://shopee.co.th/multyshopping#product_list,Beplain Sunmuse Moisture Sunscreen 50 ml.,1 sold,450
1759721426-727,https://shopee.co.th/multyshopping#product_list,Canmake Moist Prism Primer 25 g.,19 sold,450
1759721426-728,https://shopee.co.th/multyshopping#product_list,ODBO MELTING LIP TWIST 1.6 g.ลิปบาล์มเนื้อนุ่ม,,159
1759721426-729,https://shopee.co.th/multyshopping#product_list,MizuMi 3-In-1 Melt Away Cleansing Balm คลีนซิ่งบาล์ม,307 sold,890
1759721426-730,https://shopee.co.th/multyshopping#product_list,Dinto Cheek & Eye Multi Use Palette,4 sold,599
1759721426-731,https://shopee.co.th/multyshopping#product_list,4U2 Skin Nude Wear Liquid Teint Spf 35 Pa++++ 30 g. รองพื้นเนื้อลิควิด,73 sold,399
1759721426-732,https://shopee.co.th/multyshopping#product_list,Kissme-Heroine Make Secret Shading Eyeliner SP Keep,41 sold,390
1759721426-733,https://shopee.co.th/multyshopping#product_list,Supershades-Natural Eye Lashes ขนตาปลอม,69 sold,99
1759721426-734,https://shopee.co.th/multyshopping#product_list,Colorgram Tintin Dory Jam 3.5g ลิปกลอส 8 สี,125 sold,250
1759721426-735,https://shopee.co.th/multyshopping#product_list,Beplain Cicaterol Moisturizer 60 ml.,6 sold,499
1759721426-736,https://shopee.co.th/multyshopping#product_list,mixsoon Soondy Centella Asiatica Essence 100ml เอสเซ้นส์ใบบัวบก สำหรับผิวเป็นสิว แพ้ง่าย,,"1,090"
1759721426-737,https://shopee.co.th/multyshopping#product_list,Browรt Holiday Eye Glitter 3 g.,2 sold,169
1759721426-738,https://shopee.co.th/multyshopping#product_list,SuperShades Mochi Makeup Brush 1pc แปรงแต่งหน้าโมจิ,185 sold,129
1759721426-739,https://shopee.co.th/multyshopping#product_list,Baby Bright Rejulight Bright & Glow Powder Pact SPF50+PA+++ 9.5 g.+1.5 g.แป้งไบร์ท,1 sold,199
1759721426-740,https://shopee.co.th/multyshopping#product_list,Ilso Natural Mild Cleansing Oil 200 ml.,5 sold,690
1759721426-741,https://shopee.co.th/multyshopping#product_list,Dinto Chubby Mocchi Jelly Paw Paw Lip Mask,38 sold,399
1759721426-742,https://shopee.co.th/multyshopping#product_list,Rabu Rabu Cheek Blush ปัดแก้มเนื้อดี พร้อมบำรุง,6 sold,149
1759721426-743,https://shopee.co.th/multyshopping#product_list,Supershades Toffy Twist Lip Matte 2 ml.,1 sold,159
1759721426-744,https://shopee.co.th/multyshopping#product_list,JOOCYEE Glazed Rouge 3.2g.จูซซีย์ ลิปหัวใจ Chupa Chups สีสวยหวานฉ่ำ,14 sold,519
1759721426-745,https://shopee.co.th/multyshopping#product_list,Sweet Heart Slim Auto Eyebrow Pencil 0.12 g.,,269
1759721426-746,https://shopee.co.th/multyshopping#product_list,Supershades Syrup Glowy Glossy Tint 2.5 ml.ลิปกลอสทิ้นต์,7 sold,179
1759721426-747,https://shopee.co.th/multyshopping#product_list,JOOCYEE New Nude Cushion Matte 12g.จูซซีย์ คุชชั่นเนื้อแมทท์ ปกปิดติดทน ให้ผิวเนียนสวย,1 sold,739
1759721426-748,https://shopee.co.th/multyshopping#product_list,Baby Bright Cheek Glow Sunflower Blush 5.2 g.บลัชออนเนื้อครีม,1 sold,99
1759721426-749,https://shopee.co.th/multyshopping#product_list,4U2-Skin Blush & Highlight Duo Cream 12g. บลัช&ไฮไลท์ในตลับเดียว!!,5k+ sold,299
1759721426-750,https://shopee.co.th/multyshopping#product_list,JOOCYEE MULTI-PURPOSE CREAM จูซซีย์ มัลติ-เพอร์โพส ครีม ลิป,1 sold,519
1759721426-751,https://shopee.co.th/multyshopping#product_list,S Nature Aqua Collagen Peptide Triple Gel Essence 50ml. เอสเซ้นส์เติมคอลลาเจนผิว ช่วยลดเลือนริ้วรอย,12 sold,"1,300"
1759721426-752,https://shopee.co.th/multyshopping#product_list,Peripera-Water Bare Tint ลิปทินท์เนื้อน้ำ สูตร Water-Oil Base บางเบา ไม่เหนอะหนะ,199 sold,459
1759721426-753,https://shopee.co.th/multyshopping#product_list,MEILINDA Mellow Puff Mart พัฟมาพร้อมกับตะกร้าจิ๋วที่สามารถเก็บพัฟได้,3 sold,179
1759721426-754,https://shopee.co.th/multyshopping#product_list,GRN+ Season 4 Nite 63 Capsules,1 sold,799
1759721426-755,https://shopee.co.th/multyshopping#product_list,BLIN Lipstick Gloss 2.5 g.ลิปกลอส,,189
1759721426-756,https://shopee.co.th/multyshopping#product_list,Rom&Nd Zero Matte Lipstick ลิปแมท โรแมนต์ ติดทน,1k+ sold,239
1759721426-757,https://shopee.co.th/multyshopping#product_list,4U2-Skin Pro Blending Brush แปรงเบลนดิ้งสำหรับอายแชโดว์,97 sold,109
1759721426-758,https://shopee.co.th/multyshopping#product_list,Odbo Brow Styling Mascara 5 g. (Clear),5 sold,129
1759721426-759,https://shopee.co.th/multyshopping#product_list,Hue Calm Pine Bud Brightening Mask 27g.ฮิว คาล์ม ไพน์ บัด ไบร์ทเทนนิ่ง มาส์ก,2 sold,79
1759721426-760,https://shopee.co.th/multyshopping#product_list,Supershades Cushion Puff พัฟคุชชั่นนุ่มละมุน,21 sold,79
1759721426-761,https://shopee.co.th/multyshopping#product_list,Peripera Ink Airy Velvet ลิปทินส์ ( ROSE collection ),8 sold,432
1759721426-762,https://shopee.co.th/multyshopping#product_list,Ilso Moringa Purifying Pore Pad 160 ml.,9 sold,629
1759721426-763,https://shopee.co.th/multyshopping#product_list,Wakemake Glow Contouring Highlighter Palette 7.8 g. พาเลทไฮไลท์ 4 เฉดสี,9 sold,650
1759721426-764,https://shopee.co.th/multyshopping#product_list,Meilinda-The Blending Brush แปรงเบลนด์,95 sold,109
1759721426-765,https://shopee.co.th/multyshopping#product_list,JOOCYEE Satin Multi-Purpose Stick 4.5g. จูซซีย์ บลัชและลิป เติมง่าย ได้ผิวเนียนสวย,3 sold,559
1759721426-766,https://shopee.co.th/multyshopping#product_list,Baby Bright Aloe Vera Gel Eyebrow Liner 0.6 g.เจลล็อกคิ้ว,1 sold,169
1759721426-767,https://shopee.co.th/multyshopping#product_list,Gentle Colors Fixing Spray 30 ml. สเปรย์ล็อคเมคอัพ,1 sold,390
1759721426-768,https://shopee.co.th/multyshopping#product_list,Lip It Good Morning Color Lip Mask 2.4 g. ลิปมาสก์,10 sold,49
1759721426-769,https://shopee.co.th/multyshopping#product_list,BYBO Radiance & Revive Overnight Mask 50 ml.,,490
1759721426-770,https://shopee.co.th/multyshopping#product_list,Blanc Diva Be Blurry Tint 18 ml. ลิปทินต์ สีชัด ติดทน,54 sold,459
1759721426-771,https://shopee.co.th/multyshopping#product_list,barenbliss Dream Chaser Quad Eyeshadow Palette อายแชโดว์ พาเลท,24 sold,305
1759721426-772,https://shopee.co.th/multyshopping#product_list,Srichand Super Fix 18H Oil Control Foundation Powder SPF35 PA+++ แป้งพัฟผสมรองพื้น,96 sold,99
1759721426-773,https://shopee.co.th/multyshopping#product_list,JOOCYEE CRYSTAL GLOSS 8 ml.จูซซีย์ คริสตัล กลอส,1 sold,449
1759721426-774,https://shopee.co.th/multyshopping#product_list,Srichand BambamXSrichand Lip Balm 6.5 g.,13 sold,349
1759721426-775,https://shopee.co.th/multyshopping#product_list,Mixsoon Bean Cleansing Oil 195 ml.คลีนซิ่งออยล์,,980
1759721426-776,https://shopee.co.th/multyshopping#product_list,Dasique Mood Painting Lip&Cheek Palette 6 g.,41 sold,766
1759721426-777,https://shopee.co.th/multyshopping#product_list,Lip It Good Morning Color Lip Mask 10 g. ลิปมาสก์,43 sold,229
1759721426-778,https://shopee.co.th/multyshopping#product_list,Dasique Soft Blur Cheek 5.7 g.,124 sold,390
1759721426-779,https://shopee.co.th/multyshopping#product_list,LEAVES NATURAL SERUM MASK 25 ml.มาส์กหน้า,857 sold,68
