web-scraper-order,web-scraper-start-url,Name,Units Sold,Price
1759721426-139,https://shopee.co.th/multyshopping#product_list,Grrrbeauty Secret Santa Grrrbeauty Hydrocolloid Acne Patches 12 patches 10 g.,43 sold,99
1759721426-140,https://shopee.co.th/multyshopping#product_list,Glowpop Airbrush Acne Blur Concealer Pen คอนซิลเลอร์,191 sold,159
1759721426-141,https://shopee.co.th/multyshopping#product_list,SKINTIFIC Msh Niacinamide Brightening Moisture Gel 80g. MSH ไนอาซินาไมด์ ไบร์ทเทนนิ่ง มอยส์เจอร์ เจล,219 sold,689
1759721426-142,https://shopee.co.th/multyshopping#product_list,Canmake-Marshmallow Finish Powder Abloom #03 Plumeria Wreath 4 g. แป้งโปรงแสงเนื้อละเอียด เนียนนุ่ม ดุจมาร์ชแมลโล่,284 sold,399
1759721426-143,https://shopee.co.th/multyshopping#product_list,4U2-This Is Not An Eyeliner อายไลน์เนอร์ปากกา,444 sold,199
1759721426-144,https://shopee.co.th/multyshopping#product_list,Hadabirei-Mask Sheet มาส์กหน้า,3k+ sold,39
1759721426-145,https://shopee.co.th/multyshopping#product_list,Terra Pafe Perfume Balm 7 g. น้ำหอมบาล์มแบบแท่ง,483 sold,90
1759721426-146,https://shopee.co.th/multyshopping#product_list,4U2 Glassy Babe 4 g. ลิปกลอสเนื้อเอสเซนส์ (Essence) ให้ความชุ่มชื้น,,249
1759721426-147,https://shopee.co.th/multyshopping#product_list,4U2 Matte Balm 4.75 g. ลิปบาล์มเนื้อแมท,2k+ sold,299
1759721426-148,https://shopee.co.th/multyshopping#product_list,Jmella In France Disney Hair Treatment 500 ml. ทรีทเมนท์บำรุงผม,3k+ sold,399
1759721426-149,https://shopee.co.th/multyshopping#product_list,Grrr Beauty Popstar! Grrr Hydrocolloid Acne Patches แผ่นแปะสิวไฮโดรคอลลอยด์ ช่วยดูดสิว ลดรอยแดง,971 sold,149
1759721426-150,https://shopee.co.th/multyshopping#product_list,ViVa Prebiotic Baby Wipes 40 Sheets,56 sold,18
1759721426-151,https://shopee.co.th/multyshopping#product_list,Withat Luxury Fabric Softener 500ml.น้ำยาปรับผ้านุ่ม,55 sold,99
1759721426-152,https://shopee.co.th/multyshopping#product_list,Withat Juicy Jelly Tint 4.5ml วิทแทท ลิปทิ้นต์ เจลลี่ทินต์,723 sold,109
1759721426-153,https://shopee.co.th/multyshopping#product_list,4U2 Girlfriends Mousse Lip Cup 5 g.ลิปกระปุก เนื้อโยเกิร์ตมูส,5k+ sold,259
1759721426-154,https://shopee.co.th/multyshopping#product_list,Jmella In France Body Care Set 200 ml. (Blooming Peony),333 sold,299
1759721426-155,https://shopee.co.th/multyshopping#product_list,Koco Hair Removing Cream Body 35 g. ครีมกำจัดขนกาย,368 sold,49
1759721426-156,https://shopee.co.th/multyshopping#product_list,4U2 Jelly Highlight 2.3 g.ไฮไลท์เจลลี่ เนื้อนุ่ม,36 sold,199
1759721426-157,https://shopee.co.th/multyshopping#product_list,Love Potion Blush PH Black love 2.8 g บลัชสีดำ เปลี่ยนสีตามค่า PH,299 sold,179
1759721426-158,https://shopee.co.th/multyshopping#product_list,Felicia Sanitary Napkin Pad Ultra Slim Guard (29 Cm. 12ชิ้น) 1.25 g. ผ้าอนามัย,367 sold,75
1759721426-159,https://shopee.co.th/multyshopping#product_list,Kage-Brownie Shading Powder 5g. คอนทัวร์เนื้อแมททูโทน,184 sold,199
1759721426-160,https://shopee.co.th/multyshopping#product_list,Sasi-Kiss&Blush Stick ศศิ บลัชออนแท่งแบบครีม คิส แอน,2k+ sold,1
1759721426-161,https://shopee.co.th/multyshopping#product_list,The Saem-Saemmul Single Blusher บลัชออน บลัชออนสีละมุน,3k+ sold,109
1759721426-162,https://shopee.co.th/multyshopping#product_list,4U2-Matte Skin Primer 35ml. ไพรเมอร์เนื้อเจล,391 sold,399
1759721426-163,https://shopee.co.th/multyshopping#product_list,Love Potion Galaxy Gloss 3 g.เลิฟโพชั่น กาแล็กซี ลิปออยล์,241 sold,199
1759721426-164,https://shopee.co.th/multyshopping#product_list,withat Brush Cleanser Care & Clear วิทแทท สบู่ล้างแปรงแต่งหน้า 100 ML.,180 sold,209
1759721426-165,https://shopee.co.th/multyshopping#product_list,Goodal Green Tangerine Vita C Eye Gel Patch 60Ea แผ่นไฮโดรเจลมาร์กใต้ตา,8 sold,499
1759721426-166,https://shopee.co.th/multyshopping#product_list,ViVa Set Happy Viva 5 ห่อ ทิชชู่เปียก ชุดแฮปปี้วีว่า,66 sold,99
1759721426-167,https://shopee.co.th/multyshopping#product_list,Withat Cleansing Water 500 ml.คลีนซิ่งเช็ดเครื่องสำอาง,42 sold,249
1759721426-168,https://shopee.co.th/multyshopping#product_list,Soe Radiant White Glow Cushion 15g. คุชชั่นเนื้อบางเบา ปกปิด กันน้ำ กันเหงื่อ สีสวย,393 sold,359
1759721426-169,https://shopee.co.th/multyshopping#product_list,Member K-Vita Probiotics ไวต้า โพรไบโอติกส์ คอลลาเจน,482 sold,119
1759721426-170,https://shopee.co.th/multyshopping#product_list,PARMAYARD Body & Hair Mist 100 ML. สเปรย์น้ำหอม,30 sold,199
1759721426-171,https://shopee.co.th/multyshopping#product_list,LUNA LASH BLOOM IT 4 G. ลูน่าเซรั่มขนคิ้วขนตาไรผม,56 sold,249
1759721426-172,https://shopee.co.th/multyshopping#product_list,Some By Mi Real Care Mask 20 g.ชีสมาร์ก,2 sold,89
1759721426-173,https://shopee.co.th/multyshopping#product_list,Torriden DiveIn Low Molecule Hyaluronic Acid Soothing Cream 100ml.,535 sold,590
1759721426-174,https://shopee.co.th/multyshopping#product_list,Meilinda-Your Candy Dream Palatte พาเลท อายแชโดว์,5k+ sold,279
1759721426-175,https://shopee.co.th/multyshopping#product_list,KOCO Gentle Eye & Lip Makeup Remover 25 Pads 25 ชิ้น,1k+ sold,59
1759721426-176,https://shopee.co.th/multyshopping#product_list,4U2 Melted Yet? 2 g. ลิปบาล์มเนื้อเม้ลท์,370 sold,199
1759721426-177,https://shopee.co.th/multyshopping#product_list,LUNA Jelly Eye Care 3g. ลูน่า เจลลี่ อาย แคร์,724 sold,69
1759721426-178,https://shopee.co.th/multyshopping#product_list,Beplain Mung Bean Pore Clay Mask 120 ml.,22 sold,395
1759721426-179,https://shopee.co.th/multyshopping#product_list,Curesys Heartkeaf Acpair Cleansing Water 500ml.,5 sold,199
1759721426-180,https://shopee.co.th/multyshopping#product_list,MediHeal Toner Pad 170ml. #Phyto-Enzyme Peeling,2k+ sold,699
1759721426-181,https://shopee.co.th/multyshopping#product_list,Nu Formula Ultra Rich Moisturizing Cream ผลิตภัณฑ์บำรุงผิวหน้าและผิวกาย,3 sold,199
1759721426-182,https://shopee.co.th/multyshopping#product_list,2P Original Oh My Gloss Stick 2.66 g. ลิปบาล์ม,996 sold,99
1759721426-183,https://shopee.co.th/multyshopping#product_list,4U2 Skin Tint+Glow Dew Foundation Spf30 Pa+++ 30 ml.รองพื้นเนื้อฉ่ำโกลด์,393 sold,399
1759721426-184,https://shopee.co.th/multyshopping#product_list,Round Lab Birch Juice Moisturizing Cream 80 ml. มอยซ์เจอไรเซอร์ เนื้อครีม,339 sold,679
1759721426-185,https://shopee.co.th/multyshopping#product_list,Banobagi Expertise Sleeping Mask 25 ml.บาโนบากิ เอ็กซ์เพอร์ทีส,36 sold,88
1759721426-186,https://shopee.co.th/multyshopping#product_list,Braye Thin Glow Tint 3.6 g.ลิปทิ้นต์เนื้อโกลด์ สีชัด ติดทน,,495
1759721426-187,https://shopee.co.th/multyshopping#product_list,Banobagi Skin Booster Mask 25 ml.,452 sold,59
1759721426-188,https://shopee.co.th/multyshopping#product_list,Some By Mi Beta Panthenol Repair Daily Mask (30 แผ่น) 350 ML. เสริมเกราะป้องกันความชุ่มชื้น,1 sold,800
1759721426-189,https://shopee.co.th/multyshopping#product_list,Srichand Enchanted Cover Perfect Foundation SPF35 PA+++ 30 ml.รองพื้นเนื้อซอฟต์แมตต์มอบผิวสวยเล่นแสง,1 sold,295
1759721426-190,https://shopee.co.th/multyshopping#product_list,The Saem-Eco Soul Lip Oil 6ml. ลิปออยล์ บำรุงฝีปาก ชุ่มชื้น,793 sold,199
1759721426-191,https://shopee.co.th/multyshopping#product_list,MediHeal-Teatree Trouble Pad 170 ml. แผ่นบำรุงผิวในรูปแบบ Gauze Pad จากเส้นใยธรรมชาติ,4k+ sold,699
1759721426-192,https://shopee.co.th/multyshopping#product_list,Kage Fluffy Cloud Corrector Peach 6.5 ml.คอเรคเตอร์เนื้อบางเบา,24 sold,249
1759721426-193,https://shopee.co.th/multyshopping#product_list,Baby Bright Sleep Well Heating Eye Mask 1 Pcs.สลีปเวลล์ฮีตติ้งอายมาส์ก,,59
1759721426-194,https://shopee.co.th/multyshopping#product_list,Some By Mi Retinol Intense Daily Mask (30 แผ่น) 350 ML.มาสก์ชีทแบบดึงออก เพื่อผิวกระจ่างใส,2 sold,800
1759721426-195,https://shopee.co.th/multyshopping#product_list,SuperShades Travel Matte Lip Comfy 5ml. ลิปแมทเนื้อบางเบา,665 sold,159
1759721426-196,https://shopee.co.th/multyshopping#product_list,Felicia Sanitary Napkin Pad Ultra Slim Guard (24 Cm. 14ชิ้น) 1.25 g. ผ้าอนามัย,430 sold,75
1759721426-197,https://shopee.co.th/multyshopping#product_list,4U2-Skin Soft Rose Blurring Setting Powder 10g. แป้งโปร่งแสง เน,326 sold,299
1759721426-198,https://shopee.co.th/multyshopping#product_list,Supershades-universe tint 5ml. ลิปทินท์ สีแน่นทนนาน ติดทน,558 sold,99
1759721426-199,https://shopee.co.th/multyshopping#product_list,Rom&nd-Juicy Lasting Tint (No.18-21) โรแมนด์ ลิปทินต์ ติดทนเกลี่ยง่าย ไม่ตกร่อง,2k+ sold,299
1759721426-200,https://shopee.co.th/multyshopping#product_list,Cerave-Moisturising Lotion 88ml. โลชั่นบำรุงผิว,344 sold,290
1759721426-201,https://shopee.co.th/multyshopping#product_list,Dr.Althea Pure Grinding Cleansing Balm 50 g.คลีนซิ่งบาล์มบดบริสุทธิ์,2k+ sold,540
1759721426-202,https://shopee.co.th/multyshopping#product_list,4U2 Heart Blush 3.4 g. บลัชรูปหัวใจ,5k+ sold,199
1759721426-203,https://shopee.co.th/multyshopping#product_list,Canmake Illuminating Finish Powder Abloom (01) 6.5 g. อัดแข็ง 5 เฉดสี,64 sold,520
1759721426-204,https://shopee.co.th/multyshopping#product_list,2P Original-Oh My Matte Cloud ลิปแมทท์เนื้อบางเบา,1k+ sold,129
1759721426-205,https://shopee.co.th/multyshopping#product_list,ซื้อ 2 ชิ้นราคา 89 บาท จนถึงวันที่ 22/10/25 เท่านั้น****Rojukiss Double Mask 25 ml.แผ่นมาร์กหน้า,141 sold,89
1759721426-206,https://shopee.co.th/multyshopping#product_list,Canmake Mermaid Skin Gel UV SPF50+ PA++++ Big Size 80g #01,150 sold,550
1759721426-207,https://shopee.co.th/multyshopping#product_list,Rom&nd Color Lip Matte คัลเลอร์ลิปแมตท์ เนื้อนุ่ม บางเบา ไม่ตกร่อง กลบปากคล้ำ,1k+ sold,239
1759721426-208,https://shopee.co.th/multyshopping#product_list,Muiri Ampoule Core Mask 25 g.ชีสมาร์ก แผ่นมาร์กหน้า,9 sold,49
1759721426-209,https://shopee.co.th/multyshopping#product_list,Some By Mi Yuja Niacin Anti Blemish Serum 50 ml.เซรั่มลดรอยสิว ผิวกระจ่างใส,,790
1759721426-210,https://shopee.co.th/multyshopping#product_list,4U2 Skin Contour Stick Cool Tone 4 g.คอนทัวร์คลูโทน,32 sold,239
1759721426-211,https://shopee.co.th/multyshopping#product_list,4U2 Skin 2 Ways Foundation Powder Spf35 Pa+++ แป้งทูเวย์ ผสมรองพื้น ปกปิด คุมมัน,106 sold,299
1759721426-212,https://shopee.co.th/multyshopping#product_list,Needly Crossbarrier Mask (30 แผ่น) แผ่นมาสก์ ให้ความชุ่มชื้น,8k+ sold,585
1759721426-213,https://shopee.co.th/multyshopping#product_list,Gala Camille-Spinning Lubric Lip ลิปกาล่า สีชัด ติดทน,10k+ sold,299
1759721426-214,https://shopee.co.th/multyshopping#product_list,Viva Skin Prep Toner Wipe Skin Refreshing 20 Sheets,25 sold,39
1759721426-215,https://shopee.co.th/multyshopping#product_list,Srichand-Bare to Perfect Translucent Powder 10g. แป้งฝุ่นโปร่งแสงเนื้อนุ่มเนียนละเอียด บางเบา,422 sold,259
1759721426-216,https://shopee.co.th/multyshopping#product_list,Supershades Gentle Acne Care Founwear Cushion 13 g.,787 sold,299
1759721426-217,https://shopee.co.th/multyshopping#product_list,Jmella In France Hair Treatment 500 ml. ทรีทเมนท์บำรุงผม,172 sold,399
1759721426-218,https://shopee.co.th/multyshopping#product_list,Srichand Superc Brightening Intense Serum 10ml.,34 sold,39
1759721426-219,https://shopee.co.th/multyshopping#product_list,SKINTIFIC All Day Light Sunscreen Mist SPF 50PA++++ 50ml/120ml สเปรย์กันแดด ฉีดทับเมคอัพได้,160 sold,169
1759721426-220,https://shopee.co.th/multyshopping#product_list,Lip It Milky's Signature Matte Lip 2.8 g.มิลค์กี้ซิกเนเจอร์แมทท์ลิป,,299
1759721426-221,https://shopee.co.th/multyshopping#product_list,Mizumi Advance Retinoic Ester Concentrate Serum 30ml เซรั่ม เรตินอลเจนใหม่,42 sold,"1,190"
1759721426-222,https://shopee.co.th/multyshopping#product_list,Smousse Instant Fresh Dry Shampoo Blooming Breeze 100 ml.,3 sold,240
1759721426-223,https://shopee.co.th/multyshopping#product_list,ANUA HEARTLEAF 77% CLEAR PAD 160 ML / 70 แผ่น แผ่นเช็ดทำความสะอาดผิวที่สกัดจากHeartleaf,5k+ sold,679
1759721426-224,https://shopee.co.th/multyshopping#product_list,AXIS-Y Dark Spot Correcting Glow Serum 50 ml.,125 sold,659
1759721426-225,https://shopee.co.th/multyshopping#product_list,Sineha Tourmaline Matte Foundation Powder SPF30 PA+++ 5 g.แป้งพัฟทัวร์มาลีน,12 sold,79
1759721426-226,https://shopee.co.th/multyshopping#product_list,Cute Press-1-2-Beautiful Fixing Spray 60ml. สเปรย์ล็อกเมคอัพ,411 sold,169
1759721426-227,https://shopee.co.th/multyshopping#product_list,Some By Mi AHA BHA PHA 30 Days Miracle Cream 60 g.ครีมบำรุงผิวที่ช่วยปลอบประโลม,,760
1759721426-228,https://shopee.co.th/multyshopping#product_list,Neil Mask 22g. มาส์กหน้าคุณภาพจากเกาหลี แผ่นมาร์กหน้า ชีสมาร์ก,125 sold,19
1759721426-229,https://shopee.co.th/multyshopping#product_list,BANOBAGI-Korean Morning Mask บาโนบากิ มอร์นิ่งมาสก์สูตรสิว ช่วยลดสิว,3k+ sold,1
1759721426-230,https://shopee.co.th/multyshopping#product_list,Mizumi Cicafuse Calming Mask 30 ml. X (5 ซอง) แบบกล่อง,6 sold,295
1759721426-231,https://shopee.co.th/multyshopping#product_list,Cathy Doll CC Cream SPF50 PA+++ 50 ml.,18 sold,275
1759721426-232,https://shopee.co.th/multyshopping#product_list,GRN+ Season 4 All New Green Tea 60 Capsules,1 sold,799
1759721426-233,https://shopee.co.th/multyshopping#product_list,You'Re Mine Powder Lipstick ลิปเนื้อแป้งเนียนนุ่ม ฟินิชแมท,812 sold,109
1759721426-234,https://shopee.co.th/multyshopping#product_list,Cerave-Hydrating Cleanser 88ml. ทำความสะอาดผิวหน้าและผิวกาย สำหรับผิวธรรมดา-ผิวแห้ง,122 sold,220
1759721426-235,https://shopee.co.th/multyshopping#product_list,Some By Mi Retinol Intense Advanced Triple Action Eye Cream 30 ml.ครีมลดรอยคล้ำใต้ตา,,690
1759721426-236,https://shopee.co.th/multyshopping#product_list,Hada labo 30ml. ฮาดะ ลาโบะ น้ำตบจากญี่ปุ่น ลดผิวหมองคล้ำ,2k+ sold,125
1759721426-237,https://shopee.co.th/multyshopping#product_list,Srichand-Sunlution Skin Whitening Sunscreen Spf50+ Pa++++ 15ml.,15 sold,159
1759721426-238,https://shopee.co.th/multyshopping#product_list,4U2 Jewelry Box อายแชโดว์ พาเลททาตา 4 เฉดสี,5k+ sold,299
1759721426-239,https://shopee.co.th/multyshopping#product_list,KISSME Heroine Make Long & Curl Mascara Advanced Film #01,24 sold,499
1759721426-240,https://shopee.co.th/multyshopping#product_list,4U2-Skin Pro Blush Brush แปรงบลัชออน หรือคอนทัวร์,212 sold,109
1759721426-241,https://shopee.co.th/multyshopping#product_list,4U2 Girlfriends Mousse Lip Tint 3 g.ลิปทินท์มูส,10k+ sold,299
1759721426-242,https://shopee.co.th/multyshopping#product_list,Skintific Matte Fit Serum Sunscreen Spf50+ Pa++++ 30 g.,7 sold,219
1759721426-243,https://shopee.co.th/multyshopping#product_list,Skin1004-Madagascar Centella Soothing Cream 75 ml. ครีมเนื้อเจล สีน้ำตาล,157 sold,499
1759721426-244,https://shopee.co.th/multyshopping#product_list,Dasique Blending Mood Cheek บลัชออน,545 sold,590
1759721426-245,https://shopee.co.th/multyshopping#product_list,Canmake Lash Routinee 4g. เซรั่มบำรุงขนตาเนื้อเจลสีใส,40 sold,289
1759721426-246,https://shopee.co.th/multyshopping#product_list,Rabu Rabu Perfect Matte Lipstick 3g.,17 sold,105
1759721426-247,https://shopee.co.th/multyshopping#product_list,4U2 Jelly Lip Blender 11 g.แปรงเจลลี่,124 sold,99
1759721426-248,https://shopee.co.th/multyshopping#product_list,ซื้อ 2 ชิ้น ราคา 88 บาท (คละสูตรได้) จนถึงวันที่ 20/8/25 เท่านั้น***Papa Recipe Bombee Mask Pack 25 g.,81 sold,79
1759721426-249,https://shopee.co.th/multyshopping#product_list,NEEDLY MILD DEEP CLEANSING OIL 240ML. นีดลี่ คลีนซิ่งออยล์ ทำความสะอาดได้อย่างล้ำลึก,804 sold,550
1759721426-250,https://shopee.co.th/multyshopping#product_list,Skintific Matte Fit Serum Sunscreen Spf50+ Pa++++ 50 g.,5 sold,299
1759721426-251,https://shopee.co.th/multyshopping#product_list,Srichand Skin Moisture Burst Serum 50ml. เซรั่มบูสต์ผิว,101 sold,259
1759721426-252,https://shopee.co.th/multyshopping#product_list,Torriden Solid In Lip Essence 11 ml. ลิปบาล์บำรุงปาก,67 sold,179
1759721426-253,https://shopee.co.th/multyshopping#product_list,BrowIt Eyedol Matte&Glow Shadow Stick 1 g.,166 sold,195
1759721426-254,https://shopee.co.th/multyshopping#product_list,Torriden Cellmazing Small Molecule Collagen Firming Eye Cream 30 ml. ครีมบำรุงรอบดวงตา ลดเลือนริ้วรอย,34 sold,590
1759721426-255,https://shopee.co.th/multyshopping#product_list,Meilinda Butter cream Fluffy Tint 4.6 g. ลิปแมทท์ติดทน,52 sold,129
1759721426-256,https://shopee.co.th/multyshopping#product_list,Mizumi Lip Oil Serum 1.6 g.ลิปเซรั่ม,31 sold,195
1759721426-257,https://shopee.co.th/multyshopping#product_list,Dr.Althea 147 Barrier Cream 50 ml.ครีมบำรุงผิวหน้า ลดรอยแดง ผิวชุ่มชื้นขึ้น,203 sold,745
1759721426-258,https://shopee.co.th/multyshopping#product_list,Baby Bright Hya Glow Lip Balm 2.6 g.ลิปบาล์มเนื้อเนียนนุ่ม ชุ่มชื้น,1 sold,159
1759721426-259,https://shopee.co.th/multyshopping#product_list,Srichand Enchanted Cover Perfect Concealer 4.5 ml. คอนซีลเลอร์,1 sold,199
1759721426-260,https://shopee.co.th/multyshopping#product_list,Canmake-Marshmallow Finish Powder Abloom (Refill) 4 g.แคนเมค แป้งโปรงแสงเนื้อละเอียดเนียนนุ่ม ดุจมาร์ชแมลโล่,1k+ sold,390
1759721426-261,https://shopee.co.th/multyshopping#product_list,Sasi Kiss & Contour Stick 19.8 g.คอนทัวร์ สติ๊ก,67 sold,139
1759721426-262,https://shopee.co.th/multyshopping#product_list,Cute Press My Match Foundation 40 ml.ล็อกผิวสวย คุมมัน 36 ชั่วโมง,61 sold,320
1759721426-263,https://shopee.co.th/multyshopping#product_list,Beauty of Joseon Relief Sun Aqua-Fresh Rice B5 SPF50+ PA++++ 50ml.,511 sold,549
1759721426-264,https://shopee.co.th/multyshopping#product_list,Canmake-Marshmallow Finish Powder 10g. แป้งอัดแข็งไม่ผสมรองพื้น,60 sold,380
1759721426-265,https://shopee.co.th/multyshopping#product_list,SKINTIFIC 5X Ceramide Barrier Serum 50ml. เซรั่ม เซราไมด์ เสริมเกราะปกป้องผิว,19 sold,749
1759721426-266,https://shopee.co.th/multyshopping#product_list,4U2 Skin Primer Stick 8 g.ไพร์มเมอร์สติ๊ก,2k+ sold,299
1759721426-267,https://shopee.co.th/multyshopping#product_list,Meilinda Crayon over liner ลิปไลเนอร์,67 sold,179
1759721426-268,https://shopee.co.th/multyshopping#product_list,GRN+ Season 4 Queencitin 60 Capsules,,799
1759721426-269,https://shopee.co.th/multyshopping#product_list,Skintific Perfect Stay Velvet Matte Cushion 11 g.,192 sold,449
1759721426-270,https://shopee.co.th/multyshopping#product_list,Sasi-Brow-To-Be Auto Pencil 0.1g ศศิ ดินสอเขียนคิ้ว เขียนง่าย,340 sold,59
1759721426-271,https://shopee.co.th/multyshopping#product_list,Beauty Of Joseon Revive Eye Serum Ginseng+Retinal 30ml เซรั่มบำรุงรอบดวงตา ริ้วลอย,314 sold,559
1759721426-272,https://shopee.co.th/multyshopping#product_list,Elite Care Reflected Snow Sunscreen 30ml. กันแดด วิตามินอี สูตรอ่อนโยน,77 sold,259
1759721426-273,https://shopee.co.th/multyshopping#product_list,Dr.G R.E.D BLEMISH COOL SOOTHING MASK 1pc ดร.จี มาส์กเย็นคูลลิ่ง,17 sold,99
1759721426-274,https://shopee.co.th/multyshopping#product_list,Odbo Hya Clansing Pads 130 g.คลีนซิ่งแพด ล้างเครื่องสำอาง,14 sold,179
1759721426-275,https://shopee.co.th/multyshopping#product_list,Baby Bright Cherry Pop Vegan Mascara 10 g.เชอร์รี่ป๊อปวีแกนมาสคาร่า,,330
1759721426-276,https://shopee.co.th/multyshopping#product_list,4U2 Skin Duo Color Corrector 4 g.คอเรคเตอร์สติ๊ก,13 sold,239
1759721426-277,https://shopee.co.th/multyshopping#product_list,Benice Grape Exo Bright Shower Gel 450ml บีไนซ์ เจลอาบน้ำผสานเม็ดบีทส์.,7 sold,189
1759721426-278,https://shopee.co.th/multyshopping#product_list,MizuMi-Smooth Cleansing Water 500ml. คลีนซิ่งวอเตอร์,508 sold,490
1759721426-279,https://shopee.co.th/multyshopping#product_list,ROUND LAB Birch Juice Moisturizing Tone-up Sun Cream SPF50+ PA++++,269 sold,649
1759721426-280,https://shopee.co.th/multyshopping#product_list,Torriden Balanceful Cica Toner Pad 60ea (180ml) แผ่นโทนเนอร์,220 sold,439
1759721426-281,https://shopee.co.th/multyshopping#product_list,Mediheal Labocare Panteno Lips ลิปทรีตเม้นท์เนื้อบาล์ม ลิปบาล์ม บำรุงริมฝีปาก ชุ่มชื่น,10k+ sold,199
1759721426-282,https://shopee.co.th/multyshopping#product_list,Sasi-Jolly Sweet Lip Tint ลิปทินท์,247 sold,69
1759721426-283,https://shopee.co.th/multyshopping#product_list,CANMAKE Powder Cheeks 1.8 g. บลัชออน Powder Cheeks,41 sold,320
1759721426-284,https://shopee.co.th/multyshopping#product_list,Meilinda Twinkle Glitter Shadow 2.5 ml. ลิควิดกลิตเตอร์,1k+ sold,99
1759721426-285,https://shopee.co.th/multyshopping#product_list,Some By Mi Beta Panthenol Repair Cream 50 ml.สำหรับผิวแพ้ง่าย ครีมบำรุงเสริมเกราะป้องกันและให้ความชุ่มชื้น,,790
