web-scraper-order,web-scraper-start-url,Name,Units Sold,Price
1759721426-286,https://shopee.co.th/multyshopping#product_list,Jmella In France Disney Body Wash 500 ml. เจลอาบน้ำ,545 sold,399
1759721426-287,https://shopee.co.th/multyshopping#product_list,ROUND LAB Birch Juice Moisturizing Mild-up Sun Cream SPF50+ PA++++,268 sold,649
1759721426-288,https://shopee.co.th/multyshopping#product_list,Some By Mi Galactomyces Glutathione Daily Mask (30 แผ่น),2 sold,800
1759721426-289,https://shopee.co.th/multyshopping#product_list,SKINTIFIC 360 Crystal Massager Lifting Eye Cream 20g. ครีมบำรุงรอบดวงตา,106 sold,399
1759721426-290,https://shopee.co.th/multyshopping#product_list,Nu Formula Pro White Essence Lotion 150ml. เอสเซนส์บูสต์ผิว,5k+ sold,699
1759721426-291,https://shopee.co.th/multyshopping#product_list,4U2 Skin Cleansing Sheet 20g. แผ่นเช็ดหน้า ทำความสะอาดหน้า เช็ดเครื่องสำอาง,4k+ sold,109
1759721426-292,https://shopee.co.th/multyshopping#product_list,4U2-Skin Color Correcting Touch Up Skin 11g. แป้งอัดแข็ง,268 sold,299
1759721426-293,https://shopee.co.th/multyshopping#product_list,Kiss me-Heroine Prime Liquid Eyeliner Rich Keep อายไลเนอร์,173 sold,315
1759721426-294,https://shopee.co.th/multyshopping#product_list,Axis-Y Dark Spot Correcting Glow Cream 50 ml.ดาร์ก สปอต คอร์เรคติ้ง โกลว์ ครีม,,990
1759721426-295,https://shopee.co.th/multyshopping#product_list,Mediheal Sleeping Mask 20 ml.สลีฟปิ้งมาร์ก,4 sold,79
1759721426-296,https://shopee.co.th/multyshopping#product_list,Sasi-Sugar Rush Lip Tint Vol.2 ลิปทินท์,533 sold,99
1759721426-297,https://shopee.co.th/multyshopping#product_list,Canmake Marshmallow Finish Powder(Refill) แป้งอัดแข็งไม่ผสมรองพื้น,114 sold,350
1759721426-298,https://shopee.co.th/multyshopping#product_list,Torriden Balanceful Cica Mask Pack 25ml.(1แผ่น) แผ่นชีทมาสก์,610 sold,1
1759721426-299,https://shopee.co.th/multyshopping#product_list,Mediheal Derma Modeling Pack มาสก์หน้าชนิดลอกออก,1k+ sold,299
1759721426-300,https://shopee.co.th/multyshopping#product_list,Ilso Super Melting Sebum Softener 150 ml.,100 sold,739
1759721426-301,https://shopee.co.th/multyshopping#product_list,Koco-Hair Removing Cream Armpit 35 g. ครีมกำจัดขน,295 sold,49
1759721426-302,https://shopee.co.th/multyshopping#product_list,Beplain Mung Bean Cleansing Oil 200 ml.,64 sold,490
1759721426-303,https://shopee.co.th/multyshopping#product_list,Polly’s Perfume EDP 30 ML. น้ำหอมพอลลี่,77 sold,260
1759721426-304,https://shopee.co.th/multyshopping#product_list,Lip It Tint Me Healthy Balm 3 g. ทินท์มีเฮลธ์ตี้บาล์ม,202 sold,169
1759721426-305,https://shopee.co.th/multyshopping#product_list,4U2 Skin Contour Stick Warm Tone 4 g.คอนทัวร์สติ๊กวอร์มโทน,32 sold,239
1759721426-306,https://shopee.co.th/multyshopping#product_list,The Saem Cover Perfection Concealer Palette พาเลทคอนซีลเลอร์ 6 ช่อง,864 sold,389
1759721426-307,https://shopee.co.th/multyshopping#product_list,4U2 TATTOO TINT ลิปทินท์สูตรน้ำ,791 sold,99
1759721426-308,https://shopee.co.th/multyshopping#product_list,Rom&nd Juicy Lasting Tint (No.01-13) โรแมนด์ ลิปทินท์ ติดทนเกลี่ยง่าย ไม่ตกร่อง,5k+ sold,239
1759721426-309,https://shopee.co.th/multyshopping#product_list,Chubby Goodbye Acne Patch 15 Patches 10 g. แผ่นแปะสิว,187 sold,150
1759721426-310,https://shopee.co.th/multyshopping#product_list,Gala Camille-Melty Creme Balm 1.8 g.ลิปกลอสบาล์ม ลิปปากกา,10k+ sold,299
1759721426-311,https://shopee.co.th/multyshopping#product_list,Odbo Slim Shape Eye brow Auto Pencil 0.1 g.,10 sold,159
1759721426-312,https://shopee.co.th/multyshopping#product_list,Canmake-Secret Beauty Powder แป้งไม่ผสมรองพื้น,226 sold,319
1759721426-313,https://shopee.co.th/multyshopping#product_list,MizuMi Cica Soothing Moisture Gel 45ml. มอยส์เจอร์เจล,411 sold,690
1759721426-314,https://shopee.co.th/multyshopping#product_list,SKINTIFIC Symwhite 377 Dark Spot Eraser Serum 50ml.เซรั่ม ปรับสีผิว จุดด่างดำ,116 sold,649
1759721426-315,https://shopee.co.th/multyshopping#product_list,Meilinda The Shading Stick 4.5 g. คอนทัวร์,268 sold,189
1759721426-316,https://shopee.co.th/multyshopping#product_list,Kage-Base Glass Skin 15g. เบสกระจก เบสปรับผิว,2k+ sold,109
1759721426-317,https://shopee.co.th/multyshopping#product_list,Grrrbeauty RockStar Grrr Hydrocolloid Acne Patches 12 Dot แผ่นแปะสิว,122 sold,99
1759721426-318,https://shopee.co.th/multyshopping#product_list,Gravich Melasma Spotless Concentrate Cream 15 g,15 sold,490
1759721426-319,https://shopee.co.th/multyshopping#product_list,Baby Bright Jelly Crystal Lip Balm 6.4 g.เจลลี่คริสตัลลิปบาล์ม,,99
1759721426-320,https://shopee.co.th/multyshopping#product_list,Elite Care-Pure Organic Micellar Water 200ml. คลีนซิ่ง,212 sold,239
1759721426-321,https://shopee.co.th/multyshopping#product_list,Sweet Heart Acne Clear Smooth Powder SPF 30 PA+++ 6 g.,15 sold,199
1759721426-322,https://shopee.co.th/multyshopping#product_list,2P Original-Oh My Tint Velvet And Smooth 2.2 ml. ลิปทินท์เนื้อละมุน,3k+ sold,99
1759721426-323,https://shopee.co.th/multyshopping#product_list,Rom&nd-Better Than Cheek บลัชแก้ม บลัชออนเนื้อฝุ่น,934 sold,390
1759721426-324,https://shopee.co.th/multyshopping#product_list,About Tone Glow Powder Pact 8g. แป้งคุมมัน,67 sold,279
1759721426-325,https://shopee.co.th/multyshopping#product_list,Baby Bright Herbalash Brow And Lash Serum 3g เซรั่มขนตา ขนคิ้ว,2 sold,139
1759721426-326,https://shopee.co.th/multyshopping#product_list,ViVa Organic Baby Wipes 20Sheets,19 sold,25
1759721426-327,https://shopee.co.th/multyshopping#product_list,CosRx Advanced Snail Mucin Glass Glow Hydroge lMask มาร์กไฮโดรเจล,6 sold,179
1759721426-328,https://shopee.co.th/multyshopping#product_list,Meilinda C Creamy Blending Corrector 2 g. (sachet) คอเรคเตอร์แบบซอง,6 sold,99
1759721426-329,https://shopee.co.th/multyshopping#product_list,Dasique Souffle Color Pot 6.5 g.,588 sold,409
1759721426-330,https://shopee.co.th/multyshopping#product_list,Anua Cotton Pad For Toner สำลีเช็ดหน้า,101 sold,109
1759721426-331,https://shopee.co.th/multyshopping#product_list,Meilinda Fitting Lip Shaper 0.28 g.,319 sold,149
1759721426-332,https://shopee.co.th/multyshopping#product_list,Srichand Super Coverage Always Matte Cushion SPF50+ PA++++ 14 g.,,389
1759721426-333,https://shopee.co.th/multyshopping#product_list,Baby Bright 10X Glass Skin Mask Sheet 20 g.มาส์กหน้าผิวกระจก,,49
1759721426-334,https://shopee.co.th/multyshopping#product_list,Srichand-Bare To Perfect Translucent Compact Powder ศรีจันทร์ แป้งโปร่งแสง,159 sold,239
1759721426-335,https://shopee.co.th/multyshopping#product_list,Sasi-Girls Can Be Unique Eyeshadow Palette ศศิ อายแชโดว์ พาเลท,163 sold,95
1759721426-336,https://shopee.co.th/multyshopping#product_list,Browit Eye shadow Palette 4 g. พาเลตทาเปลือกตา,25 sold,229
1759721426-337,https://shopee.co.th/multyshopping#product_list,SKYNLAB Deep Clean Medium Soft Toothbrush 4 Pcs.แปรงสีฟันดีพคลีนมีเดียมซอฟท์ 4ชิ้น,,199
1759721426-338,https://shopee.co.th/multyshopping#product_list,Grrrbeauty Hydrocolloid Acne Patches Transparent Butterfly 12Dots 20 g.,36 sold,99
1759721426-339,https://shopee.co.th/multyshopping#product_list,JudyDoll Three Color Concealer Palette 0.9 g.คอนซีลเลอร์ พาเลท,116 sold,319
1759721426-340,https://shopee.co.th/multyshopping#product_list,Dr.G 3X Panthenol Hyaluronic Acid Booster Serum 30 ml.เซรั่มล็อกน้ำเพิ่มความฉ่ำ กักเก็บความชุ่มชื้น 3 เท่า,,590
1759721426-341,https://shopee.co.th/multyshopping#product_list,Torriden Modeling Pack (Balanceful Cica 30g. / Dive In 25g.),125 sold,199
1759721426-342,https://shopee.co.th/multyshopping#product_list,Supershades-Intense Level Liner อายไลเนอร์,3k+ sold,39
1759721426-343,https://shopee.co.th/multyshopping#product_list,JudyDoll Long Wearing Cushion 14 g. คุชชั่นปกปิดริ้วรอยได้อย่างเป็นธรรมชาติ,52 sold,659
1759721426-344,https://shopee.co.th/multyshopping#product_list,4U2-Skin Eye And Lip Makeup Remover 100ml. รีมูฟเวอร์ล้างเมคอัพ,90 sold,199
1759721426-345,https://shopee.co.th/multyshopping#product_list,SKINTIFIC-Cover All Perfect Cushion Spf35 Pa++++ 11ml. คุชชั่น ปกปิดสูง ติดทนนาน,232 sold,449
1759721426-346,https://shopee.co.th/multyshopping#product_list,Some By Mi Retinol Intense Reactivating Serum 30 ml.เซรั่มเรตินอลผิวกระจก,,850
1759721426-347,https://shopee.co.th/multyshopping#product_list,4U2 Skin Airy Matte Cushion Spf50+ Pa++++ 10 g.คุชชั่นเนื้อซอฟต์แมท,34 sold,209
1759721426-348,https://shopee.co.th/multyshopping#product_list,MLEN DIARY Lash Bond 4g. กาวติดขนตาปลอม แบบหัวแปรงปัด,15 sold,379
1759721426-349,https://shopee.co.th/multyshopping#product_list,Supershades-Blah Blah Lip Balm ลิปบาล์ม บำรุงริมฝีปากเนื้อฉ่ำ,1k+ sold,159
1759721426-350,https://shopee.co.th/multyshopping#product_list,Bybo Soft&Gentle Micellar Sensitive Cleansing Pad 250 g.คลีนซิ่งแพด สูตรไมเซลลาร์ 60 แผ่น,6 sold,690
1759721426-351,https://shopee.co.th/multyshopping#product_list,Goodal Green Tangerine Vita C Dark Spot Care Pad 70Ea,8 sold,650
1759721426-352,https://shopee.co.th/multyshopping#product_list,Meilinda-Glitter Pop Eye Stick อายแชโดว์สติ๊กเนื้อแมทท์ครีมมี่นุ่มละมุน นุ่มลื่น,202 sold,119
1759721426-353,https://shopee.co.th/multyshopping#product_list,Kage Charcoal Puff 2 g. พัฟทรงหยดน้ำ พร้อมกล่องเก็บพัฟ,,99
1759721426-354,https://shopee.co.th/multyshopping#product_list,4U2-Curl Up Eyelash Curler ที่ดัดขนตา,264 sold,99
1759721426-355,https://shopee.co.th/multyshopping#product_list,Supershades Let's Go Back Every Night Lip Balm ลิปบาล์มเปลี่ยนสีเนื้อฉ่ำ,47 sold,219
1759721426-356,https://shopee.co.th/multyshopping#product_list,MEILINDA Creamy Blending Corrector&Concealer คอนซีลเลอร์แบบซอง,,59
1759721426-357,https://shopee.co.th/multyshopping#product_list,Wellage Real One Day Kit 16 ml. แคปซูล เซรั่ม,22 sold,149
1759721426-358,https://shopee.co.th/multyshopping#product_list,Elite Care Pure Active Organic Micellar 200ml.+50ml.,2k+ sold,319
1759721426-359,https://shopee.co.th/multyshopping#product_list,Bybo Soft&Gentle Deep Cleansing Oil Pad 200 g.,3 sold,690
1759721426-360,https://shopee.co.th/multyshopping#product_list,JOOCYEE Multi-Use Compact Duo 9g.,8 sold,559
1759721426-361,https://shopee.co.th/multyshopping#product_list,Raburabu Whitening Roll On 0.7g. โรลออน ระงับกลิ่นกาย ใต้วงแขน,19 sold,85
1759721426-362,https://shopee.co.th/multyshopping#product_list,JOOCYEE Blush 4g.บลัชหัวใจ Chupa Chups โทนสีสวย เกลี่ยง่าย,32 sold,419
1759721426-363,https://shopee.co.th/multyshopping#product_list,Rom&nd-Glasting Water Tint (4 สีใหม่) โรแมนด์ ลิปทิ้นท์เนื้อฉ่ำวาว เนื้อบางเบา,520 sold,239
1759721426-364,https://shopee.co.th/multyshopping#product_list,Sasi Aholic Jelly Tint Balm 16.7 g.อะโฮลิค เจลลี่ ทินท์ บาล์ม,73 sold,139
1759721426-365,https://shopee.co.th/multyshopping#product_list,Rom&nd-Bare Juicy Lasting Tint (NO.31-33) โรแมนด์ ลิปทินท์ ทาง่าย ไม่ตกร่อง,417 sold,239
1759721426-366,https://shopee.co.th/multyshopping#product_list,Love Potion Super White Serum 15ml.,30 sold,249
1759721426-367,https://shopee.co.th/multyshopping#product_list,Elite Care-Pure Active Organic Cleanser Gel 100,46 sold,239
1759721426-368,https://shopee.co.th/multyshopping#product_list,Papa Recipe Tea Tree Control Pad 130 ml. (70pads),1 sold,790
1759721426-369,https://shopee.co.th/multyshopping#product_list,Madagascar Centella Hyalu-Cica First Ampoule 50ml. ไฮยาลูซิก้า,26 sold,499
1759721426-370,https://shopee.co.th/multyshopping#product_list,Canmake Metalook Mascara 4g. (No.01 Black) มาสคาร่าหัวกลมไร้ขนแปรง,36 sold,339
1759721426-371,https://shopee.co.th/multyshopping#product_list,Browit By Nong Chat-Smooth And Slim Inner Eye Liner,136 sold,99
1759721426-372,https://shopee.co.th/multyshopping#product_list,Med B 1 Day Mask Pack 28ml แผ่นมาสก์หน้า บำรุงผิว,5k+ sold,49
1759721426-373,https://shopee.co.th/multyshopping#product_list,Nu Formula Pro White Brightening Gel Cream 25g.,4 sold,549
1759721426-374,https://shopee.co.th/multyshopping#product_list,Dermedy Crystal Glow Hydrogel Mask 16 g.มาร์กชีส,804 sold,29
1759721426-375,https://shopee.co.th/multyshopping#product_list,Kage Aqua Glow Sunscreen Spf 50 + Pa+++ 50 g.,878 sold,339
1759721426-376,https://shopee.co.th/multyshopping#product_list,Pramy Zanmang Loopy Moisturizing Makeup Setting Spray Matte Finish 30ml.สเปรย์ล็อกเมคอัพ,9 sold,349
1759721426-377,https://shopee.co.th/multyshopping#product_list,Grrrbeauty Mini Clearstar Hydrocolloid Acne Patches 8 Pcs. 1 ซองมี 8 ชิ้น,18 sold,59
1759721426-378,https://shopee.co.th/multyshopping#product_list,Skintific Retinol Skin Renewal Moisturizer 30 g. มอยเจอไรเซอร์เรตินอล,41 sold,449
1759721426-379,https://shopee.co.th/multyshopping#product_list,Axis-Y-Vegan Collagen Eye Serum 10 ml.,,"1,090"
1759721426-380,https://shopee.co.th/multyshopping#product_list,4U2 Basic Extra Slim Brow Pencil 0.08 g. ดินสอเขียนคิ้วหัวเรียวเล็ก,5k+ sold,199
1759721426-381,https://shopee.co.th/multyshopping#product_list,Odbo C Hello Blusher 4 g.บลัชออนเนื้อละเอียด,6 sold,179
1759721426-382,https://shopee.co.th/multyshopping#product_list,Sweet Heart Sweet Cheeks Liquid Blush 2.5 g.,9 sold,269
1759721426-383,https://shopee.co.th/multyshopping#product_list,4U2 Mascara Remover 6.60 g. มาสคาร่ารีมูฟเวอร์,145 sold,199
1759721426-384,https://shopee.co.th/multyshopping#product_list,Cathy Doll Skinny Soft Brow Pencil 0.06 g.,82 sold,99
1759721426-385,https://shopee.co.th/multyshopping#product_list,Koco Baby Wet Wipes ทิชชู่เปียก 20 แผ่น,150 sold,25
1759721426-386,https://shopee.co.th/multyshopping#product_list,Lip It Lip Primer Topper 2.8 g.ลิปไพรเมอร์แอนด์ท็อปเปอร์,,299
1759721426-387,https://shopee.co.th/multyshopping#product_list,MizuMi Skincare UV Lip Glassy Balm ลิปบาล์มกันแดด,455 sold,290
1759721426-388,https://shopee.co.th/multyshopping#product_list,Round Lab Soybean Mask แผ่นมาส์กหน้า มาส์กถั่วเหลืองดำ เนื้อครีม,24 sold,69
1759721426-389,https://shopee.co.th/multyshopping#product_list,Round Lab Soybean Panthenol Ampoule 50 ml.เซรั่มแอมพูลเติมความชุ่มชื้น,8 sold,650
1759721426-390,https://shopee.co.th/multyshopping#product_list,Beplain Mung Bean Pore Tight-Up Serum 30 ml.,14 sold,395
1759721426-391,https://shopee.co.th/multyshopping#product_list,Hada Labo-Premium Cream 14g. ครีมบำรุงผิวหน้า เพื่อผิวกระจ่างใสและชุ่มชื่นล้ำลึก ช่วยลดความหมองคล้ำ ลดจุดด่างดำ,62 sold,169
1759721426-392,https://shopee.co.th/multyshopping#product_list,4U2-My Best Lash Ever 6g. มาสคาร่าสูตรขนตาเรียงเส้น,37 sold,199
1759721426-393,https://shopee.co.th/multyshopping#product_list,2P Original Oh My Balm Juicy And Glowy ลิปบาล์ม,554 sold,89
1759721426-394,https://shopee.co.th/multyshopping#product_list,Nattynutty Dewy Lip Oil 6g.ลิปออยล์,16 sold,259
1759721426-395,https://shopee.co.th/multyshopping#product_list,CANMAKE Lame Mania กลิตเตอร์อายแชโดว์,28 sold,320
1759721426-396,https://shopee.co.th/multyshopping#product_list,Dasique Water Dewy Gel Cushion [HeartEdition] Spf50+Pa++++ 10 g.,24 sold,740
1759721426-397,https://shopee.co.th/multyshopping#product_list,Rom&nd The Universe Liquid Glitter กลิตเตอร์เกาหลีดอลลี่อาย,140 sold,269
1759721426-398,https://shopee.co.th/multyshopping#product_list,Sasi Girls Can Survive Foundation Powder 8.5g แป้งผสมรองพื้น,147 sold,199
1759721426-399,https://shopee.co.th/multyshopping#product_list,***GWP***4U2-HeartBlush 3.4 g. No.1 บลัชหัวใจ ของแถมห้ามจำหน่าย,17 sold,999
1759721426-400,https://shopee.co.th/multyshopping#product_list,Rom&nd Sheer Tinted Stick 32 g.,127 sold,239
1759721426-401,https://shopee.co.th/multyshopping#product_list,4U2 Extra Curl Mascara มาสคาร่า,10 sold,159
1759721426-402,https://shopee.co.th/multyshopping#product_list,Grrr Beauty Heart Breaker Grrr Hydrocolloid Acne Patches,293 sold,189
1759721426-403,https://shopee.co.th/multyshopping#product_list,Grrrbeauty Happy Holiday Grrr Hydrocolloid Acne Patches แผ่นแปะสิว,203 sold,99
1759721426-404,https://shopee.co.th/multyshopping#product_list,Cerave Reparative Hand Cream เซราวี รีแพร์เรทีฟ แฮนด์ ครีมบำรุงผิวมือ 50มล.,28 sold,280
1759721426-405,https://shopee.co.th/multyshopping#product_list,4U2-Skin Ultra Hd Pro Blender ฟองน้ำเกลี่ยรองพื้น,177 sold,109
1759721426-406,https://shopee.co.th/multyshopping#product_list,Grrr Beauty Bunny Star Grrr Hydrocolloid Acne Patches แผ่นแปะสิว ดูดสิว,4k+ sold,149
1759721426-407,https://shopee.co.th/multyshopping#product_list,Canmake-Cream Cheek Pearl Type แคนเมค ครีมบลัชออน สีสวย,335 sold,280
1759721426-408,https://shopee.co.th/multyshopping#product_list,Supershades-Mini Cushion Puff 3pcs พัฟฟองน้ำ,414 sold,99
1759721426-409,https://shopee.co.th/multyshopping#product_list,Browit C Professional Clean Eye&Lip Remover 150 ml.,12 sold,289
1759721426-410,https://shopee.co.th/multyshopping#product_list,Rom&nd Bare Water Tint 3.5 g. ลิปทินต์,263 sold,239
1759721426-411,https://shopee.co.th/multyshopping#product_list,Meilinda Baby Blink Lashes 21 g. ขนตาปลอม,102 sold,219
1759721426-412,https://shopee.co.th/multyshopping#product_list,Meilinda C Dewy Balm ลิปบาล์ม เนื้อบาล์ม สีชัด ไม่เหนียวเหนอะหนะ,99 sold,99
1759721426-413,https://shopee.co.th/multyshopping#product_list,CANMAKE Moon Glow Highlighther 3.5 G.ไฮไลท์พระจันทร์,22 sold,350
1759721426-414,https://shopee.co.th/multyshopping#product_list,Grrr Beauty Hydrocolloid Acne Patches Besties 12 Patches 20 g. แผ่นแปะสิวเกอบิวตี้,3k+ sold,139
1759721426-415,https://shopee.co.th/multyshopping#product_list,Goodal Green Tangerine Vita C Dark Spot Care Serum Sheet Mask (1แผ่น) มาร์กชีส,3 sold,80
1759721426-416,https://shopee.co.th/multyshopping#product_list,BrowIt C Star Galaxy Long Stay Mascara 8 g.,14 sold,169
1759721426-417,https://shopee.co.th/multyshopping#product_list,Lalarecipe Yuzu Vita C Ampoule 50 ml.,6 sold,"1,260"
1759721426-418,https://shopee.co.th/multyshopping#product_list,Sasi-Shining Star Baby Compact Powder แป้ง แป้งเด็กอัดแข็ง เนื้,70 sold,159
1759721426-419,https://shopee.co.th/multyshopping#product_list,Meilinda Mellow Matte Shadow Stick 1.5 g.,64 sold,199
1759721426-420,https://shopee.co.th/multyshopping#product_list,Supershades Universe Dash ลิปทินท์ ทินท์น้ำอัดแท่ง,264 sold,99
1759721426-421,https://shopee.co.th/multyshopping#product_list,DR.G R.E.D BLEMISH CLEAR HYAL-CICA SOOTHING SERUM 50 ml.,11 sold,790
1759721426-422,https://shopee.co.th/multyshopping#product_list,JOOCYEE CREAM BLUSH DUO จูซซีย์ ครีม บลัช ดูโอ้,2 sold,569
1759721426-423,https://shopee.co.th/multyshopping#product_list,BLIN YOURS TINT OIL 2.5 g.ลิปทิ้นต์ออยล์,3 sold,189
1759721426-424,https://shopee.co.th/multyshopping#product_list,Rom&nd-Bare Layer Palette มัลติพาเลท,197 sold,490
1759721426-425,https://shopee.co.th/multyshopping#product_list,Sasi-Acne Sol Comfort Sunscreen​ Spf50+ Pa++++ 15ml. ศศิ กันแดด,40 sold,149
1759721426-426,https://shopee.co.th/multyshopping#product_list,Alese Dark Spot and Anti Melasma Concentrate Cream 30 g.,2 sold,490
1759721426-427,https://shopee.co.th/multyshopping#product_list,4U2 MELLOW OIL BALM 3 G. บาล์มเปลี่ยนสีปาก pH Change ชุ่มชื้น,603 sold,189
1759721426-428,https://shopee.co.th/multyshopping#product_list,Odbo Glowing Skin Highlighter 4.5 g.,27 sold,159
1759721426-429,https://shopee.co.th/multyshopping#product_list,Srichand Barrier Boost Soothing Gel Cream 50 ml.เจลครีม,4 sold,389
1759721426-430,https://shopee.co.th/multyshopping#product_list,Glowpop Click Me Perfect Lip Tint 2.5 g. ลิปปทินท์,189 sold,99
1759721426-431,https://shopee.co.th/multyshopping#product_list,Baby Bright Flora Moist To Matte Lip 3 g.ลิปแมท,3 sold,99
1759721426-432,https://shopee.co.th/multyshopping#product_list,Baby Bright Star Flower Lip 0.95 g.ลิปดอกดาวสุดคิวท์ สีชัด,,49
1759721426-433,https://shopee.co.th/multyshopping#product_list,Nu Formula Sebum Control & Dark Spot Ampoule Serum 30 ml.,45 sold,399
1759721426-434,https://shopee.co.th/multyshopping#product_list,Mille-Snail Bright Primer ไพรเมอร์เบลอรูขุมขน คุมมัน,133 sold,399
1759721426-435,https://shopee.co.th/multyshopping#product_list,Odbo Romance Mood Eye Palette 6 g.,21 sold,229
1759721426-436,https://shopee.co.th/multyshopping#product_list,CANMAKE Muchi Puru Tint ลิปทินท์ เนื้อเนียนนุ่ม เกลี่ยง่าย,109 sold,297
1759721426-437,https://shopee.co.th/multyshopping#product_list,BrowIt C Multiverse Eyebrow Palette 4 g.,105 sold,189
1759721426-438,https://shopee.co.th/multyshopping#product_list,2Some1 Whitening Perfume Lotion โลชั่นน้ำหอม,64 sold,39
1759721426-439,https://shopee.co.th/multyshopping#product_list,Skin1004 Madagascar Centella Probio Cica Essense Toner 210ml.,44 sold,699
1759721426-440,https://shopee.co.th/multyshopping#product_list,GRN+ Season 4 All New Pink 90 Capsules,,799
1759721426-441,https://shopee.co.th/multyshopping#product_list,4U2 Lip Oil 3.8 ml. ลิปออยล์ ปากฉ่ำวาว ชุ่มชื้น,262 sold,299
1759721426-442,https://shopee.co.th/multyshopping#product_list,MEILINDA AIRY FITTING FOUNDATION เมลินดา แอร์รี่ ฟิตติ้ง ฟาวน์เดชั่น (แบบซอง),,59
1759721426-443,https://shopee.co.th/multyshopping#product_list,4U2-The Glittering กลิตเตอร์เนื้อเจล ติดทน,169 sold,299
1759721426-444,https://shopee.co.th/multyshopping#product_list,SureFresh Skin Nectar Gel Wash 50 g. เจลล้างหน้าลดอุณภูมิผิว เจลล้างหน้าลดสิว,2 sold,289
1759721426-445,https://shopee.co.th/multyshopping#product_list,Meilinda 101 Slim Drawing Liner เจลอายไลเนอร์ เ,162 sold,89
1759721426-446,https://shopee.co.th/multyshopping#product_list,Polly’s Perfume EDP 10 ml. น้ำหอมพกพา,234 sold,199
