web-scraper-order,web-scraper-start-url,Name,Units Sold,Price
1759721426-1,https://shopee.co.th/multyshopping#product_list,The Saem Cover Perfection Tips Concealer 6.5 ml. คอนซีลเลอร์เนื้อลิควิด ปกปิดริ้วรอย จุดด่างดำ รอยสิว,30k+ sold,39
1759721426-2,https://shopee.co.th/multyshopping#product_list,Kage Syrup Glossy Lips 9g. ลิปกลอส,3k+ sold,199
1759721426-3,https://shopee.co.th/multyshopping#product_list,Rom&nd The Juicy Lasting Tint 3.5 g.แพคเกจใหม่,3k+ sold,239
1759721426-4,https://shopee.co.th/multyshopping#product_list,Rom&nd-Better Than Palette Secret Garden พาเลทอายแชโดว์เนื้อแมตต์ ชิมเมอร์,10k+ sold,400
1759721426-5,https://shopee.co.th/multyshopping#product_list,JM Solution Selfie Barrier Mask 30 ml. มาส์กแผ่นบำรุงผิวหน้า,7k+ sold,28
1759721426-6,https://shopee.co.th/multyshopping#product_list,Rom&nd-Glasting Color Gloss 6 Colors 4g. ลิปลิซ่า ลิปกลอส,8k+ sold,149
1759721426-7,https://shopee.co.th/multyshopping#product_list,Atopalm-Soothing Gel Lotion 120ml. โลชั่นบำรุงผิวหน้าและผิวกาย,10k+ sold,390
1759721426-8,https://shopee.co.th/multyshopping#product_list,HuinGom Micellar Cleansing Hydro Boost Cleanser 500 ml.,880 sold,229
1759721426-9,https://shopee.co.th/multyshopping#product_list,Anua Heartleaf Quercetinol Pore Deep Cleanser Foam 150 ml.,3k+ sold,299
1759721426-10,https://shopee.co.th/multyshopping#product_list,Anua Heartleaf 77% Soothing Toner โทนเนอร์พี่จุน ลดสิวผด ผิวแสบแดง ปรับสมดุลผิว,30k+ sold,200
1759721426-11,https://shopee.co.th/multyshopping#product_list,Kage-Filter Blush บลัชเนื้อครีม ฟิลเตอร์บลัช สีชัด,10k+ sold,159
1759721426-12,https://shopee.co.th/multyshopping#product_list,La Glace Mini Ideal Corrector 2 g.คอเรคเตอร์ปกปิดความคล้ำ,6 sold,69
1759721426-13,https://shopee.co.th/multyshopping#product_list,Rom&nd Dewy Ful Water Tint ลิปทินท์เนื้อดิวอี้ ลิปทินท์ฉ่ำวาว สีชัด ทาง่าย,4k+ sold,149
1759721426-14,https://shopee.co.th/multyshopping#product_list,HuinGom Fluffy Air Facial Cotton Pad 120 g.,251 sold,89
1759721426-15,https://shopee.co.th/multyshopping#product_list,Gvana Dandisnow Eyeshadow Stick 2In1 0.66g อายแชโดว์ในรูปแบบแท่ง 2in1,829 sold,219
1759721426-16,https://shopee.co.th/multyshopping#product_list,Needly Daily Toner Pad 310 G. นีดลี่เดลี่โทนเนอร์แพด โทนเนอร์แบบแผ่นลดสิว ชุ่มชื้น กระชับรูขุมขน ผลัดเซลล์ผิว ขนาดใหม่,40k+ sold,459
1759721426-17,https://shopee.co.th/multyshopping#product_list,LA GLACE ULTIMATE BADDIE LIP MATTE ลิปแมทลากลาส 10 เฉดสี เนื้อนุ่ม soft matte เบลอร่องปาก กลบปากคล้ำ ผสมได้หลายลุค,151 sold,199
1759721426-18,https://shopee.co.th/multyshopping#product_list,Anua-Heartleaf Pore Control Cleansing Oil 200ml. คลีนซิ่งออยล์,3k+ sold,460
1759721426-19,https://shopee.co.th/multyshopping#product_list,Biodance Real Deep Mask 34g.(1ชิ้น/แผ่น) มาส์กหน้าไฮโดรเจล,2k+ sold,150
1759721426-20,https://shopee.co.th/multyshopping#product_list,กดสั่ง 2 ชิ้น ราคา 129 บาท (คละสูตรได้)จนถึงวันที่ 22/10/25*Benice Shower Cream 400ml. ครีมอาบน้ำกลิ่นหอมละมุน,3k+ sold,129
1759721426-21,https://shopee.co.th/multyshopping#product_list,LA GLACE TONER PADS REFILL 160 ML. (แบบรีฟีล 80 แผ่น),121 sold,359
1759721426-22,https://shopee.co.th/multyshopping#product_list,Withat Parfum วิทแทท 10 ML.น้ำหอม,3k+ sold,109
1759721426-23,https://shopee.co.th/multyshopping#product_list,Dr.Althea 345 Relief Cream 50 ml.ครีมดูแลปัญหาผิวอักเสบจากสิวโดยเฉพาะ Resveratrol Post Acne ผิวอิ่มฟู,1k+ sold,655
1759721426-24,https://shopee.co.th/multyshopping#product_list,Kage Truebrow Mybrow Mascara 4 g. มาสคาร่าคิ้ว เปลี่ยนสีคิ้ว,6k+ sold,179
1759721426-25,https://shopee.co.th/multyshopping#product_list,Rom&nd-Glasting Melting Balm (01-15) ลิปบาล์ม เนื้อฉ่ำ บางเบา ปากชุ่มชื้น,5k+ sold,239
1759721426-26,https://shopee.co.th/multyshopping#product_list,Rom&nd The Juicy Lasting Tint Mini ลิปทินต์มินิ,5k+ sold,199
1759721426-27,https://shopee.co.th/multyshopping#product_list,Round Lab-Birch Juice Moisturizing Sunscreen 50ml. กันแดด สูตรอ่อนโยน ชุ่มชื้น ไม่หนักหน้า,10k+ sold,375
1759721426-28,https://shopee.co.th/multyshopping#product_list,Felicia Sanitary Napkin Pad Soft&Slim (29 Cm. 12ชิ้น) 1.25 g. ผ้าอนามัย,1k+ sold,59
1759721426-29,https://shopee.co.th/multyshopping#product_list,Kiss My Body Perfume Shower Gel 380 ml.,190 sold,169
1759721426-30,https://shopee.co.th/multyshopping#product_list,Skin Editor Black Pearl&Niacinamide Brightening Body Scrub 500 g.,1k+ sold,109
1759721426-31,https://shopee.co.th/multyshopping#product_list,กดสั่ง 2 ชิ้น ในราคา 99 บาท Refill (คละสูตรได้) จนถึงวันที่ 22/10/25***Benice Shower Cream Firm White 400ml. ครีมอาบน้ำ,5k+ sold,9
1759721426-32,https://shopee.co.th/multyshopping#product_list,LA GLACE MELTED SUNDAE LIP CLICK | ลิปไอติมลากลาส สีระเรื่อ & ปากฉ่ำขั้นสุด ลิปกด ลิปฉ่ำ,866 sold,109
1759721426-33,https://shopee.co.th/multyshopping#product_list,Rom&nd-Juicy Lasting Tint (NO.22-25) โรแมนด์ ลิปทินท์ ทาง่าย ไม่ตกร่อง,7k+ sold,239
1759721426-34,https://shopee.co.th/multyshopping#product_list,La Glace Fiery Baby Dolly Eye Stick 0.28 เขียนง่าย มือใหม่ใช้ได้ ดอลลี่อาย,114 sold,259
1759721426-35,https://shopee.co.th/multyshopping#product_list,The Saem-Cover Perfection Fixealer คอนซีลเลอร์ ปกปิดริ้วรอย จุดด่างดำ รอยสิว ไม่เป็นคราบ,8k+ sold,39
1759721426-36,https://shopee.co.th/multyshopping#product_list,Banobagi-Final Sleeping Mask บาโนบากิ สลีปปิ้ง มาส์ก มาส์กหน้าสูตรคุณหมอ,10k+ sold,1
1759721426-37,https://shopee.co.th/multyshopping#product_list,4U2 Fruity Tint 3 g.ลิปทินต์ผลไม้,404 sold,99
1759721426-38,https://shopee.co.th/multyshopping#product_list,La Glace Airy Skin Concealer 6 g.คอนซีลเลอร์เนื้อเซรั่ม,1 sold,389
1759721426-39,https://shopee.co.th/multyshopping#product_list,กดสั่ง 2 ชิ้น ราคา 99 บาท (คละสูตรได้) Refillจนถึงวันที่ 22/10/25****Benice Happy Summer Shower Cream 400 ml. แบบเติม,361 sold,109
1759721426-40,https://shopee.co.th/multyshopping#product_list,Gvana Dandi Liner 0.5 ml.อายไลเนอร์หัวเล็ก,7 sold,219
1759721426-41,https://shopee.co.th/multyshopping#product_list,4U2 MELLOW GLOW BALM บาล์มบำรุงปาก ลิปบาล์ม 4u2 บำรุงริมฝีปาก บาล์มปากจือ,679 sold,189
1759721426-42,https://shopee.co.th/multyshopping#product_list,Banobagi Final Sleeping Mask Whitening Plus บาโนบากิ สลีปปิ้งมาสก์,4k+ sold,50
1759721426-43,https://shopee.co.th/multyshopping#product_list,Kage Cloudy Lip Blending 2 g. ลิปไลเนอร์เบลอขอบปาก,2k+ sold,199
1759721426-44,https://shopee.co.th/multyshopping#product_list,Kage-Moji Puff โมจิพัฟ ทรง 3 เหลี่ยม,4k+ sold,1
1759721426-45,https://shopee.co.th/multyshopping#product_list,Cute Press-Mineral Facial Mist 100ml. คิวท์เพรส สเปรย์น้ำแร่ บำรุงผิวหน้า เติมความชุ่มชื้น,1k+ sold,1
1759721426-46,https://shopee.co.th/multyshopping#product_list,LA GLACE BRATTITUDE TWO TONE POWDER BLUSH | บลัชฝุ่นทูโทนลากลาส บลัชฝุ่น 6 สี บลัชออน สีนัว ละมุน,324 sold,289
1759721426-47,https://shopee.co.th/multyshopping#product_list,BIODANCE Refreshing Sea Kelp Real Deep Mask 34 ML. (1แผ่น/ชิ้น),3 sold,189
1759721426-48,https://shopee.co.th/multyshopping#product_list,Dr.Althea Vitamin C Boosting Serum 30 ml.เซรั่มวิตามินซี เข้มข้น 63% บูสผิวกระจ่างใส ใน 10 วัน*,305 sold,540
1759721426-49,https://shopee.co.th/multyshopping#product_list,4U2-Jelly Tint ลิปทินท์เนื้อเยลลี่ เบาสบายปาก,10k+ sold,69
1759721426-50,https://shopee.co.th/multyshopping#product_list,JM Solution Collection Mask 30 ml. มาส์กแผ่นบำรุงผิวหน้า,1k+ sold,99
1759721426-51,https://shopee.co.th/multyshopping#product_list,LOVE POTION Buddy Creamy Blush 4.5g บลัคตรีม,5k+ sold,99
1759721426-52,https://shopee.co.th/multyshopping#product_list,Rom&nd-Blur Fudge Tint โรแมนด์ ลิปทินท์เนื้อฟลัดจ์ เบลอริมฝีปากสวย ติดทนนาน,6k+ sold,239
1759721426-53,https://shopee.co.th/multyshopping#product_list,The Saem Saemmul Eye Primer 5.8 g.,9k+ sold,9
1759721426-54,https://shopee.co.th/multyshopping#product_list,ซื้อ 2 จ่าย 1 ในราคา 179 บาท (คละสูตรได้) จนถึงวันที่ 22/10/25***Benice Glow & Perfume Collagen Body Serum 170ml. เซ,577 sold,179
1759721426-55,https://shopee.co.th/multyshopping#product_list,Jmella In France Body Lotion 500 ml. โลชั่นบำรุงผิวกาย,503 sold,199
1759721426-56,https://shopee.co.th/multyshopping#product_list,BIODANCE Hydro Cera nol Real Deep Mask 34 ML. (1ชิ้น/แผ่น),8 sold,189
1759721426-57,https://shopee.co.th/multyshopping#product_list,BIODANCE Radiant Vita Niacinamide Real Deep Mask 34 ML. (1แผ่น/ชิ้น),3 sold,189
1759721426-58,https://shopee.co.th/multyshopping#product_list,MediAnswer Collagen Mask 37 g.,6k+ sold,99
1759721426-59,https://shopee.co.th/multyshopping#product_list,MediHeal- Vitamed Brightening Pad 170 ml. โทนเนอร์แพด,2k+ sold,699
1759721426-60,https://shopee.co.th/multyshopping#product_list,MediHeal-Collagen Ampoule Pad 170 ml.,9k+ sold,609
1759721426-61,https://shopee.co.th/multyshopping#product_list,Dermedy Multi Vita Mask 25 ml.เดอร์มีดี มัลติ ไวต้า มาสก์,10 sold,19
1759721426-62,https://shopee.co.th/multyshopping#product_list,Jmella In France Body Wash 500 ml. เจลอาบน้ำ,474 sold,199
1759721426-63,https://shopee.co.th/multyshopping#product_list,Odbo Iconic Eyeshadow Palette 7 g.อายแชโดว์พาเลทตา,104 sold,249
1759721426-64,https://shopee.co.th/multyshopping#product_list,Skin1004 Madagascar Centella Ampoule 30ml. แอมพูลบำรุงผิวเข้มข้น,1k+ sold,299
1759721426-65,https://shopee.co.th/multyshopping#product_list,Jmella In France Hair Shampoo 500 ml. แชมพู,384 sold,188
1759721426-66,https://shopee.co.th/multyshopping#product_list,About Tone Blur Powder Pact 9g. แป้งเบลอผิว,1k+ sold,189
1759721426-67,https://shopee.co.th/multyshopping#product_list,Skin1004-Madagascar Centella Ampoule 55ml. เซรั่มสูตรอ่อนโยน,5k+ sold,459
1759721426-68,https://shopee.co.th/multyshopping#product_list,Gvana Bloomy Vender Balm 12g. ลิปบาล์มดอกไม้,44 sold,199
1759721426-69,https://shopee.co.th/multyshopping#product_list,Anua Heartleaf Succinic Moisture Cleansing Foam 150 ml.,742 sold,399
1759721426-70,https://shopee.co.th/multyshopping#product_list,Sasi SuperStar Glow Lip Tint 2 g.ทินท์ฉ่ำโกลว์ สีชัดติดทน,,99
1759721426-71,https://shopee.co.th/multyshopping#product_list,Nature Republic-Fresh Powdery Sun Stick SPF50+ PA++++ กันแดดแบบแท่ง เนื้อบางเบา,3k+ sold,450
1759721426-72,https://shopee.co.th/multyshopping#product_list,Rom&nd Juicy Roll Cheek 0.03 kg.บลัชน้ำกลิ้ง,227 sold,299
1759721426-73,https://shopee.co.th/multyshopping#product_list,Grrrbeauty PetLover Hydrocolloid Acne Patches 12 Pcs.,23 sold,99
1759721426-74,https://shopee.co.th/multyshopping#product_list,Gala Camille Catching Skin Loosen Concealer 2.5 g.คอนซีลเลอร์เนื้อบางเบา,1 sold,199
1759721426-75,https://shopee.co.th/multyshopping#product_list,Banobagi-Vita Genic Jelly Mask 30ml. บาโนบากิ ไวต้า จีนิค มาส์กเจลลี่,20k+ sold,49
1759721426-76,https://shopee.co.th/multyshopping#product_list,2P Original Oh My Tint Gloss 3 g.ลิปกลอสทิ้นต์อเนื้อฉ่ำวาว,1k+ sold,159
1759721426-77,https://shopee.co.th/multyshopping#product_list,2P Original Oh My Blush Biscuit Bare 5.2 g. 2in1 ครีมบลัชเนื้อละมุน,147 sold,219
1759721426-78,https://shopee.co.th/multyshopping#product_list,Withat Flawless Veil Concealer 5g.คอนซีลเลอร์,176 sold,169
1759721426-79,https://shopee.co.th/multyshopping#product_list,Srichand Skin Moisture Burst Gel Cream 10ml. ศรีจันทร์ เจลครีมล็อคผิว เติมความชุ่มชื่น,853 sold,1
1759721426-80,https://shopee.co.th/multyshopping#product_list,About Tone Blur pack 9g. แป้งอัดแข็งโปร่งแสงไม่ผสมรองพื้น,5k+ sold,189
1759721426-81,https://shopee.co.th/multyshopping#product_list,Gala Camille Blandy Tracie Lip 2.6 g.ลิปแบบ 2 IN 1 มีทั้งฝั่งลิปดินสอเขียนขอบปาก และฝั่งลิปจุ่ม,8k+ sold,209
1759721426-82,https://shopee.co.th/multyshopping#product_list,Needly Cica Chid Chilling Pad 200 g. นีดลี่โทนเนอร์แพด ลดสิว ผิวชุ่มฉ่ำ,6k+ sold,400
1759721426-83,https://shopee.co.th/multyshopping#product_list,4U2-Flower Blush บลัชดอกไม้ เนื้อละเอียดนุ่มละมุน,953 sold,199
1759721426-84,https://shopee.co.th/multyshopping#product_list,Daeng Gi Meo Ri Jingi Anti Hair Loss Shampoo/Treatment 300ml,1k+ sold,455
1759721426-85,https://shopee.co.th/multyshopping#product_list,ANUA Peach 77 Niacin Essence Toner 250ml. โทนเนอร์ผิวพีช,71 sold,650
1759721426-86,https://shopee.co.th/multyshopping#product_list,Rom&nd x Inapsquare Juicy Lasting Tint ลิปทินต์สีใหม่ 25 BARE GRAPE,685 sold,159
1759721426-87,https://shopee.co.th/multyshopping#product_list,2P ORIGINAL OH MY BLUSH DOT 3 g. บลัชออนสูตรน้ำ (สีเบอร์ 09-10 ไม่แถมพัฟ),3k+ sold,189
1759721426-88,https://shopee.co.th/multyshopping#product_list,4U2-Serum Tint Oil ลิปทินท์ปากฉ่ำเงา,944 sold,299
1759721426-89,https://shopee.co.th/multyshopping#product_list,Atopalm-Mle Lotion 120ml. โลชั่นบำรุงผิวหน้าและผิวกายสูตร,10k+ sold,400
1759721426-90,https://shopee.co.th/multyshopping#product_list,4U2 Super Slim 0.1 Eyeliner 0.5 g. อายไลเนอร์หัวเล็ก กรีดง่าย เหมาะกับมือใหม่,49 sold,69
1759721426-91,https://shopee.co.th/multyshopping#product_list,La Glace Baebie Vibes Cream Blush 3.8 g. ครีมบลัชลากลาส,1k+ sold,289
1759721426-92,https://shopee.co.th/multyshopping#product_list,Rom&nd-Bare Water Cushion คุชชั่นเนื้อบางเบา สูตรผิวฉ่ำโกลว์ ผิวชุ่มชื้น,3k+ sold,450
1759721426-93,https://shopee.co.th/multyshopping#product_list,Rom&nd-Better than palette #00 Light & Glitter garden โรแมนด์ อายแชโดวกลิตเตอร์,446 sold,590
1759721426-94,https://shopee.co.th/multyshopping#product_list,Torriden DiveIn Low Molecule Hyaluronic Acid Mask Pack 27ml. (1แผ่น) แผ่นมาร์คหน้า,2k+ sold,69
1759721426-95,https://shopee.co.th/multyshopping#product_list,Rom&nd-Better Than Finish 12g.โรแมนด์ แป้งอัดแข็ง เนื้อละเอียด บางเบา,4k+ sold,295
1759721426-96,https://shopee.co.th/multyshopping#product_list,Skintific Peptide Nourishing Lip Serum 6.5 ml. ลิปบำรุงปาก,138 sold,299
1759721426-97,https://shopee.co.th/multyshopping#product_list,ซื้อ 2 จ่าย 1 ในราคา 169 บาท (คละสูตรได้) จนถึงวันที่ 22/10/25***Benice Glow & Moist Shea Butter Collagen Body Lotion,343 sold,169
1759721426-98,https://shopee.co.th/multyshopping#product_list,MediHeal-Madecassoside Blemish Pad 170 ml. แผ่นบำรุงผิวเฉพาะจุด สูตรเคลียร์รอยสิว,4k+ sold,699
1759721426-99,https://shopee.co.th/multyshopping#product_list,Mizumi Cicafuse Calming Mask 30 ml.มาร์กชีส 1 แผ่น,28 sold,59
1759721426-100,https://shopee.co.th/multyshopping#product_list,LA GLACE DAILY PADS TRAVEL SIZE | โทนเนอร์แพดลากลาสแบบพกพา มี2สูตร โทนเนอร์แพด ใช้ง่าย พกได้ทุกที่,123 sold,159
1759721426-101,https://shopee.co.th/multyshopping#product_list,Skin Editor Daily Uv Protection Sunscreen Spf50+Pa++++ 150 ml.โลชั่นกันแดด กันน้ำ กันเหงื่อ,2k+ sold,159
1759721426-102,https://shopee.co.th/multyshopping#product_list,Viva Makeup Remover Wipe Acne 20 Sheets ทิชชู่เปียกเช็ดเครื่องสำอาง,67 sold,39
1759721426-103,https://shopee.co.th/multyshopping#product_list,Jmella In France Disney Hair Shampoo 500 ml.,1k+ sold,188
1759721426-104,https://shopee.co.th/multyshopping#product_list,Daeng Gi Meo Ri Jinji Anti Hair Loss Scalp Tomic 100ml,229 sold,450
1759721426-105,https://shopee.co.th/multyshopping#product_list,Luna Jelly Eye Mask 90 g.แผ่นแปะตาไฮโดรเจล,1k+ sold,379
1759721426-106,https://shopee.co.th/multyshopping#product_list,Skin1004-Madagascar Centella Tone Brightening Capsule Ampoule 100ml. แคปซูลแอมพลู,675 sold,699
1759721426-107,https://shopee.co.th/multyshopping#product_list,JudyDoll Highlight & Contour 9 g.ไฮท์ไลท์ & คอนทัวร์ แบบตลับ,1k+ sold,435
1759721426-108,https://shopee.co.th/multyshopping#product_list,MizuMi Skin Fit Invisible Pad 130 ml.โทนเนอร์แพดล่องหน,,395
1759721426-109,https://shopee.co.th/multyshopping#product_list,Meilinda Pure Glow Glossy Balm 2 g. ลิปบาล์ม เนื้อฉ่ำวาว,324 sold,89
1759721426-110,https://shopee.co.th/multyshopping#product_list,4U2 Twogether Matte&Gloss Lip 2 g.ลิปแมทกลอส,10k+ sold,199
1759721426-111,https://shopee.co.th/multyshopping#product_list,4U2 Better Half Duo Lip ลิปแมท ลิปกลอส 2in1,1k+ sold,199
1759721426-112,https://shopee.co.th/multyshopping#product_list,4U2 Soft Matte Cushion Spf50Pa+++ 10 g.,105 sold,299
1759721426-113,https://shopee.co.th/multyshopping#product_list,4U2-Dear Me Liquid Blush บลัชออนแก้มฉ่ำ,1k+ sold,89
1759721426-114,https://shopee.co.th/multyshopping#product_list,MediHeal- Watermide Pad 170 ml. โทนเนอร์แพดสูตรบำรุงผิวแห้งกร้าน ลดความหยาบกร้าน,3k+ sold,699
1759721426-115,https://shopee.co.th/multyshopping#product_list,Meilinda Shade Pop Contour&Highlight 3.60g.ไฮไลท์ คอนทัวร์สติ๊ก,49 sold,179
1759721426-116,https://shopee.co.th/multyshopping#product_list,The Saem-Cover Perfection Triple Pot Concealer คอนซีลเลอร์ตลับ ปกปิดริ้วรอย เรียบเนียน,7k+ sold,259
1759721426-117,https://shopee.co.th/multyshopping#product_list,Love Potion Bags To Blink Concentrated Eye Cream 10 g.เลิฟ โพชั่น แบ็กส์ ทู บลิ้งค์ คอนเซินเทรทิด อาย ครีม,,99
1759721426-118,https://shopee.co.th/multyshopping#product_list,Srichand Juicy Syrup Duo Lasting Lip 2.6 ml ลิปสติกดูโอ้ 2 in 1 เนื้อแมท,60 sold,59
1759721426-119,https://shopee.co.th/multyshopping#product_list,4U2 Dot Dot Liner 0.5 g. ไลเนอร์สร้างกระ,114 sold,159
1759721426-120,https://shopee.co.th/multyshopping#product_list,กดสั่งซื้อ 2 ชิ้น ราคา 239 บาท จนถึงวันที่ 22/10/25 เท่านั้น***Renu Fresh 355 ml. ผลิตภัณฑ์ทำความสะอาดคอนแทคเลนส์,217 sold,239
1759721426-121,https://shopee.co.th/multyshopping#product_list,(คอลเลคชั่นเก่า) Love Potion Lovely Perfume 10 ml. น้ำหอมเลิฟโพชั่นเลิฟลี่,671 sold,159
1759721426-122,https://shopee.co.th/multyshopping#product_list,Gvana Fruity Floral Lip Oil 2.5g. ลิปออยล์,4k+ sold,219
1759721426-123,https://shopee.co.th/multyshopping#product_list,Odbo Slim Gel Liner 0.7g.เจลไลเนอร์,12 sold,199
1759721426-124,https://shopee.co.th/multyshopping#product_list,4U2-Skin Pro Skin Longwear Foundation Powder Spf50+ Pa++++,632 sold,199
1759721426-125,https://shopee.co.th/multyshopping#product_list,กดสั่งซื้อ 2 ชิ้น ราคา 199 บาท จนถึงวันที่ 22/10/25 (คละสูตรได้)***D-nee Body Lotion 180ml. ดีนี่ บอดี้โลชั่น,112 sold,199
1759721426-126,https://shopee.co.th/multyshopping#product_list,2P Original-Oh My Blush 2in1 บลัชออน บลัชออนไร้ฝุ่น,2k+ sold,149
1759721426-127,https://shopee.co.th/multyshopping#product_list,Dinto Blur Glowy Lip Tint ลิปทินต์,6k+ sold,399
1759721426-128,https://shopee.co.th/multyshopping#product_list,SKINTIFIC Symwhite 377 Dark Spot Moisture Gel 30g. มอยเจอร์ เจล บำรุงผิวหน้า ปรับสีผิว จุดด่างดำ,191 sold,399
1759721426-129,https://shopee.co.th/multyshopping#product_list,BANOBAGI Damage Skin Premium Mask 25 ml.มาสก์บำรุงผิวหน้า สูตรกู้ผิวเสีย,422 sold,55
1759721426-130,https://shopee.co.th/multyshopping#product_list,Odbo Iconic Powder Blush 4.2 g.,69 sold,159
1759721426-131,https://shopee.co.th/multyshopping#product_list,MediHeal Toner Pad 170ml. #Retinol Collagen Lifting โทนเนอร์แพด,2k+ sold,499
1759721426-132,https://shopee.co.th/multyshopping#product_list,WONBE Premium Modeling Mask มาสก์เจล,292 sold,69
1759721426-133,https://shopee.co.th/multyshopping#product_list,Daeng Gi Meo Ri Jingi Anti Hair Loss Shampoo/Treatment 50ml แชมพู ครีมนวดผม สูตรสมุนไพร จากเกาหลี บำรุงผม,2k+ sold,149
1759721426-134,https://shopee.co.th/multyshopping#product_list,Round Lab Birch Juice Moisturizing Cleanser 150ml เจลล้างหน้า,319 sold,349
1759721426-135,https://shopee.co.th/multyshopping#product_list,Lalarecipe Yuzu Vita C Ampoule Pad 150 ml.โทนเนอร์แพดเนื้อแอมพูล,423 sold,400
1759721426-136,https://shopee.co.th/multyshopping#product_list,Terra Pafe Comfrey Herbal Balm 7 g.,332 sold,1
1759721426-137,https://shopee.co.th/multyshopping#product_list,Some By Mi Yuja Niacin Anti Blemish Daily Mask (30 แผ่น) 350 ML. ผิวกระจ่างใส,3 sold,800
1759721426-138,https://shopee.co.th/multyshopping#product_list,ซื้อ 2 ชิ้น ราคา 159 บาท จนถึงวันที่ 22/10/25 เท่านั้น*** D-nee Beauty Cotton Pad Save Toner (200 แผ่น) สำลีแผ่น,263 sold,159
